StudyId,Title,Authors,PublicationName,AlternateName,Abstract,Url,AuthorAddress,Year,Doi,ReferenceType,Keywords,PdfRelativePath,CustomId,DateTimeStudyAdded,SystematicSearchId,SystematicSearchName,InvestigatorIds,InvestigatorNames,DateTimeOfScreenings,ScreeningDecisions,ScreeningStatus
fbdc7817-1b5c-4f73-bb6d-48b58f64365f,Effect of Protons on GABA<inf>A</inf> Receptors in Central Neurons of Various Types,E. I Solntseva;Y. V Bukanova;V. G Skrebitsky,Bulletin of Experimental Biology and Medicine,Bulletin of Experimental Biology and Medicine,"Whole-cell patch-clamp technique was employed to record chloride ionic current I<inf>GABA</inf> evoked by fast (600 msec) application of GABA to hippocampal pyramidal neurons and cerebellar Purkinje cells isolated from rat brain. GABA solution in the application pipette was either neutral (pH 7.4) or acidic (pH 7.0 or 6.0). Application of protons to neurons causes a rapid, reversible, and dose-dependent decrease in the amplitude of I<inf>GABA</inf>; the effect was more pronounced on hippocampal neurons (carrying both synaptic and extrasynaptic GABA<inf>A</inf> receptors) than in cerebellar Purkinje cells (predominantly equipped with synaptic GABA<inf>A</inf> receptors). In hippocampal neurons, pharmacological isolation of extrasynaptic component from total I<inf>GABA</inf> was performed with GABA<inf>A</inf> receptor antagonist gabazine (50 nM). The extrasynaptic component of I<inf>GABA</inf> was stronger blocked by protons than total I<inf>GABA</inf>. It was concluded that acidic medium produced more potent blocking effect on extrasynaptic GABA<inf>A</inf> receptors than on synaptic ones. Copyright © 2020, Springer Science+Business Media, LLC, part of Springer Nature.",https://link.springer.com/journal/10517,"(Solntseva, Bukanova, Skrebitsky) Research Center of Neurology, Moscow, Russian FederationE.I. Solntseva, Research Center of Neurology, Moscow, Russian Federation. E-mail: synaptology@mail.ru",2020,http://dx.doi.org/10.1007/s10517-020-04722-y,Journal Article,cerebellum;GABA<inf>A</inf> receptor;gabazine;hippocampus;protons;animal cell;article;controlled study;ic50;ion current;nonhuman;protein quaternary structure;Purkinje cell;pyramidal nerve cell;rat;3 amino 2 (3 carboxypropyl) 6 (4 methoxyphenyl)pyridazinium bromide;4 aminobutyric acid A receptor;amiloride;proton,,,2023-09-11 10:19:02,6f80e5a7-0e5d-41fa-b87d-c92751c63e4d,FN FP CNS 11092023,0a9b53c0-0532-49dd-a346-648057d10f6e,Emmy van der Ree,2023-10-24 14:20:07,Included,InsufficientlyScreened
9efa6ee5-c5ba-421b-8b13-334f30fecaf1,Clinical outcome after fractionated radiation therapy for pituitary adenoma,R. A Abu-Hijlih;Y Ismael;H Ghatasheh;A Fawzi;A Alsharbaji;M Elyan;B Al-Haj;A Almousa,International Journal of Radiation Oncology Biology Physics,International Journal of Radiation Oncology Biology Physics,"Purpose/Objective(s): Pituitary tumors are relatively uncommon. Primary goals of treatment include normalization of hormonal level and improving visual or neurological symptoms. Surgery, medical treatment, irradiation, or combination of these modalities is used to achieve these goals. The purpose of this analysis is to determine the clinical outcome of pituitary adenoma treated with fractionated external beam radiation therapy. Materials/Methods: This is a retrospective analysis of pituitary adenoma treated at our center between 2006 and 2014. A total of 88 patients with biopsy-proven adenomas were identified. Median age at diagnosis was 38 years (18-79 years) and 49 patients (56%) were males. Majority of tumors were marcoadenoma (87%). Presenting symptoms were mainly hormonal disturbance in 43 patients (49%), visual defects in 29 patients (33%) and headache in 21 patients (23%). Prolactinomas were the most common secretory adenoma in 22 patients (51%), followed by growth hormone secreting adenomas in 15 patients (35%) and ACTH-secreting tumors in 5 patients (12%), while one patient had TSH-secreting adenoma. The cohort follow up time reached 87 months (mean; 32 months). The primary endpoints are clinical and biochemical control. Result(s): Thirteen patients lost to follow up, therefore 75 patients were included in the final analysis. Surgery was the primary treatment modality in 70 patients (93%).While medical treatment was used for inoperable or hormonal secreting adenoma in 30 patients (40%). Fractionated radiation therapy was delivered to 28 patients (37%), indications for radiation were symptomatic, incompletely resected tumors (16 patients) or persistent hypersecretion (12 patients). For secretory tumors the median radiation dose was 52Gy (50-54Gy), and lower dose was delivered for non-secretory adenoma; mean 50Gy (45-52Gy). For patients received radiation therapy, the tumor control rate is 75% for non-functioning adenomas, and 69% for functioning adenomas. Conclusion(s): Pituitary adenoma is a slow growing benign tumor; however devastating effect can result from neurological deficits or hormonal imbalance. Our results reveal that functioning adenomas carry worse prognosis. Fractionated radiation therapy, as an adjunct to surgery and medical treatment, offers good clinical and biochemical control for pituitary adenoma. More aggressive multimodal approach and incorporation of new radiation technique may help to achieve better clinical outcome.",https://ovidsp.ovid.com/ovidweb.cgi?T=JS&CSC=Y&NEWS=N&PAGE=fulltext&D=emed16&AN=72109587,"(Abu-Hijlih, Ismael, Ghatasheh, Fawzi, Elyan, Al-Haj, Almousa) King Hussein Cancer Center, Amman 11941, Jordan (Alsharbaji) King Hussein Medical City, Amman, JordanR.A. Abu-Hijlih, King Hussein Cancer Center, Amman 11941, Jordan",2015,,Journal Article,hypophysis adenoma;American;society;oncology;radiotherapy;human;patient;adenoma;therapy;surgery;neoplasm;follow up;radiation;hypophysis tumor;biopsy;male;ACTH secreting adenoma;thyrotropin secreting adenoma;diagnosis;external beam radiotherapy;irradiation;growth hormone secreting adenoma;neurologic disease;prolactinoma;benign tumor;radiation dose;headache;cancer control;prognosis;thyrotropin;corticotropin,,,2023-09-11 10:19:02,6f80e5a7-0e5d-41fa-b87d-c92751c63e4d,FN FP CNS 11092023,0a9b53c0-0532-49dd-a346-648057d10f6e,Emmy van der Ree,2023-10-18 12:56:08,Excluded,InsufficientlyScreened
60fe99e4-1537-476b-aaec-f12614d2caf1,Preclinical and clinical study of extracellular DNA in cancer and other diseases associated with apoptosis disorder. [Russian],I. N Vasilyeva;V. G Bespalov,Voprosy Onkologii,Voprosy Onkologii,"Oncological diseases at all stages of carcinogenesis are accompanied by violation of apoptosis processes. Drug and radiotherapy activates the apoptosis of tumor cells. This study presents the results of extracellular DNA changes after exposure to ionizing radiation and low-frequency noise are presented, administration of vitamins; in animals with benign prostatic hyperplasia, with ovarian cancer; in clinical studies in patients with chronic obstructive pulmonary disease, and in acute disorders of cerebral circulation. The possibilities of determination of extracellular DNA for the evaluation of the action of carcinogens, the complex diagnosis of precancerous diseases, the progression of precancerous diseases and malignant tumors are considered. Copyright © 2018 Izdatel'stvo Meditsina. All rights reserved.",https://ovidsp.ovid.com/ovidweb.cgi?T=JS&CSC=Y&NEWS=N&PAGE=fulltext&D=emed19&AN=623767011,"(Vasilyeva, Bespalov) N.N. Petrov National Medical Research Center of Oncology, United States (Bespalov) ITMO University, St.-Petersburg, Russian Federation",2018,,Journal Article,Apoptosis;Extracellular DNA;Nucleosomes;Pathology;Precancerous diseases;acute disease;article;cancer growth;cerebrovascular disease;chronic obstructive lung disease;clinical study;human;ionizing radiation;low frequency noise;nonhuman;ovary cancer;preclinical study;prostate hypertrophy;radiation exposure;carcinogen;DNA/ec [Endogenous Compound];unclassified drug;vitamin;extracellular DNA/ec [Endogenous Compound],,,2023-09-11 10:19:02,6f80e5a7-0e5d-41fa-b87d-c92751c63e4d,FN FP CNS 11092023,,,,,InsufficientlyScreened
fdc04d62-c9f2-4f6a-bcc4-6014c70f8c4c,Quality of life after palliative treatment for oesophageal carcinoma - A prospective comparison between stent placement and single dose brachytherapy,M. Y. V Homs;M. L Essink-Bot;G. J. J. M Borsboom;E. W Steyerberg;P. D Siersema,European Journal of Cancer,European Journal of Cancer,"Metal stent placement and single dose brachytherapy are commonly used treatment modalities for the palliation of inoperable oesophageal carcinoma. We investigated generic and disease-specific health-related quality of life (HRQoL) after these palliative treatments. Patients with dysphagia from inoperable oesophageal carcinoma were randomised to placement of a covered Ultraflex stent (n=108) or single dose (12 Gy) brachytherapy (n=101). We obtained longitudinal data on disease-specific (dysphagia score, European Organisation for Reasearch and Treament of Cancer (EORTC) OES-23, visual analogue pain scale) and generic (EORTC Quality of Life-Core 30 Questionnarie (QLQ-C30), Euroqol (EQ)-5D) HRQoL at monthly home visits by a specially-trained research nurse. We compared HRQoL between the two treatments and analysed changes in HRQoL during follow-up. Dysphagia improved more rapidly after stent placement than after brachytherapy, but long-term relief of dysphagia was better after brachytherapy. For generic HRQoL, there was an overall significant difference in favour of brachytherapy on four out of five functional scales of the EORTC QLQ-C30 (role, emotional, cognitive and social) (P<0.05). Generic HRQoL deteriorated over time on all functional scales of the EORTC QLQ C-30 and EQ-5D, in particular physical and role functioning (on average -23 and -24 on a 100 points scale during 0.5 years of follow-up). This decline was more pronounced in the stent group. Major improvements were seen on the dysphagia and eating scales of the EORTC OES-23, in contrast to other scales of this disease-specific measure, which remained almost stable during follow-up. Reported levels of chest or abdominal pain remained stable during follow-up in both treatment groups, general pain levels increased to a minor extent. The effects of single dose brachytherapy on HRQoL compared favourably to those of stent placement for the palliation of oesophageal cancer. Future studies on palliative care for oesophageal cancer should at least include generic HRQoL scales, since these were more responsive in measuring patients' functioning and well-being during follow-up than disease-specific HRQoL scales. © 2004 Elsevier Ltd. All rights reserved.",https://ovidsp.ovid.com/ovidweb.cgi?T=JS&CSC=Y&NEWS=N&PAGE=fulltext&D=emed8&AN=39036761,"(Homs, Essink-Bot, Borsboom, Steyerberg, Siersema) Dept. of Gastroenterol. and Hepatol., Erasmus MC-Univ. Med. Ctr. Rotterdam, P.O. Box 2040, 3000CA, Rotterdam, Netherlands (Homs, Essink-Bot, Borsboom, Steyerberg, Siersema) Department of Public Health, Erasmus MC/University, Medical Center Rotterdam, NetherlandsM.Y.V. Homs, Dept. of Gastroenterol. and Hepatol., Erasmus MC-Univ. Med. Ctr. Rotterdam, P.O. Box 2040, 3000CA, Rotterdam, Netherlands. E-mail: m.homs@erasmusmc.nl",2004,http://dx.doi.org/10.1016/j.ejca.2004.04.021,Journal Article,Brachytherapy;Oesophageal cancer;Palliation;Quality of life;Stent placement;abdominal pain;adult;aged;article;cancer palliative therapy;cancer patient;cognition;controlled study;dysphagia;eating;emotional stability;esophagus carcinoma/rt [Radiotherapy];esophagus carcinoma/th [Therapy];female;follow up;health care organization;human;intermethod comparison;longitudinal study;major clinical study;male;nurse;pain assessment;priority journal;professional practice;questionnaire;radiation dose;randomization;rating scale;scoring system;social aspect;statistical significance;stent;thorax pain;visual analog scale;wellbeing,,,2023-09-11 10:19:02,6f80e5a7-0e5d-41fa-b87d-c92751c63e4d,FN FP CNS 11092023,0a9b53c0-0532-49dd-a346-648057d10f6e,Emmy van der Ree,2023-10-23 08:15:37,Excluded,InsufficientlyScreened
625c8de4-0f02-4814-ba2c-fdfac40c4787,Dose-dependent changes in renal (1)H-/(23)Na MRI after adjuvant radiochemotherapy for gastric cancer,S Haneder;J. M Budjan;S. O Schoenberg;S Konstandin;L. R Schad;R. D Hofheinz;V Gramlich;F Wenz;F Lohr;J Boda-Heggemann,Strahlentherapie und Onkologie,Strahlentherapie und Onkologie,"PURPOSE: Combined radiochemotherapy (RCT) for gastric cancer with three-dimensional conformal radiotherapy (3D-CRT) results in ablative doses to the upper left kidney, while image-guided intensity-modulated radiotherapy (IG-IMRT) allows kidney sparing despite improved target coverage. Renal function in long-term gastric cancer survivors was evaluated with 3T functional magnetic resonance imaging (MRI) including diffusion-weighted imaging (DWI) and (23)Na imaging.PATIENTS AND METHODS: Five healthy volunteers and 13 patients after radiotherapy were included: 11xIG-IMRT; 1x3D-CRT; 1x ""positive control"" with stereotactic body radiotherapy (SBRT) of a metastasis between the spleen/left kidney. Radiation doses were documented for the upper/middle/lower kidney subvolumes. Late toxicity was evaluated based on CTC criteria, questionnaire, and creatinine values. Morphological sequences, DWI images, and (23)Na images were acquired using a (1)H/(23)Na-tuned body-coil before/after intravenous water load (WL). Statistics for [(23)Na] (concentration) and apparent diffusion coefficient (ADC) values were calculated for upper/middle/lower renal subvolumes. Corticomedullary [(23)Na] gradients and [(23)Na] differences after WL were determined.RESULTS: No major morphological alteration was detected in any patient. Minor scars were observed in the cranial subvolume of the left kidney of the 3D-CRT and the whole kidney of the control SBRT patient. All participants presented a corticomedullary [(23)Na] gradient. After WL, a significant physiological [(23)Na] gradient decrease (p < 0.001) was observed in all HV and IG-IMRT patients. In the cranial left kidney of the 3D-CRT patient and the positive control SBRT patient, the decrease was nonsignificant (p = 0.01, p = 0.02). ADC values were altered nonsignificantly in all renal subvolumes (all participants). Renal subvolumes with doses >= 35 Gy showed a reduced change of the [(23)Na] gradient after WL (p = 0.043). No participants showed clinical renal impairment.CONCLUSIONS: Functional parameters of renal (23)Na MRI after gastric IG-IMRT are identical to those of healthy volunteers, in contrast to renal subvolumes after ablative doses in the control and 3D-CRT patient. While kidney doses to the cortex below 20-25 Gy in fractional doses of ~ 1 Gy in IG-IMRT (combined with intensified chemotherapy) do not seem to cause significant MRI morphological or functional alterations, doses of > 35 Gy in 1.5-2 Gy fractions clearly result in impairment.",https://ovidsp.ovid.com/ovidweb.cgi?T=JS&CSC=Y&NEWS=N&PAGE=fulltext&D=med12&AN=25445156,"Haneder, Stefan. Institute of Clinical Radiology and Nuclear Medicine, University Medical Centre Mannheim, University of Heidelberg, Mannheim, Germany.",2015,https://dx.doi.org/10.1007/s00066-014-0787-x,Journal Article,"*Acute Kidney Injury/et [Etiology];*Acute Kidney Injury/pa [Pathology];Adult;Aged;*Chemoradiotherapy, Adjuvant/ae [Adverse Effects];Chemoradiotherapy, Adjuvant/mt [Methods];Dose-Response Relationship, Radiation;Female;Humans;Magnetic Resonance Imaging;Male;Middle Aged;Protons;*Radiation Injuries/et [Etiology];*Radiation Injuries/pa [Pathology];Radiopharmaceuticals;Radiotherapy Dosage;Sodium Isotopes;*Stomach Neoplasms/pa [Pathology];*Stomach Neoplasms/th [Therapy];Treatment Outcome;0 (Protons);0 (Radiopharmaceuticals);0 (Sodium Isotopes)",,,2023-09-11 10:19:02,6f80e5a7-0e5d-41fa-b87d-c92751c63e4d,FN FP CNS 11092023,0a9b53c0-0532-49dd-a346-648057d10f6e,Emmy van der Ree,2023-10-24 14:17:19,Excluded,InsufficientlyScreened
811eb1ab-29df-4316-bfd4-73ec2b8b7767,Treatment Outcomes of Incidental Intracranial Meningiomas: Results from the IMPACT Cohort,A. I Islim;M Mohan;R. D. C Moon;N Rathi;R Kolamunnage-Dona;A Crofton;B. J Haylock;S. J Mills;A. R Brodbelt;M. D Jenkinson,World Neurosurgery,World Neurosurgery,"Background: Incidental findings such as meningioma are becoming increasingly prevalent. There is no consensus on the optimal management of these patients. The aim of this study was to examine the outcomes of patients diagnosed with an incidental meningioma who were treated with surgery or radiotherapy. Method(s): Single-center retrospective cohort study of adult patients diagnosed with an incidental intracranial meningioma (2007-2015). Outcomes recorded were postintervention morbidity, histopathologic diagnosis, and treatment response. Result(s): Out of 441 patients, 44 underwent treatment. Median age at intervention was 56.1 years (interquartile range [IQR], 49.6-66.5); patients included 35 women and 9 men. The main indication for imaging was headache (25.9%). Median meningioma volume was 4.55 cm<sup>3</sup> (IQR, 1.91-8.61), and the commonest location was convexity (47.7%). Six patients underwent surgery at initial diagnosis. Thirty-eight had intervention (34 with surgery and 4 with radiotherapy) after a median active monitoring duration of 24 months (IQR, 11.8-42.0). Indications for treatment were radiologic progression (n = 26), symptom development (n = 6), and patient preference (n = 12). Pathology revealed World Health Organization (WHO) grade 1 meningioma in 36 patients and WHO grade 2 in 4 patients. The risk of postoperative surgical and medical morbidity requiring treatment was 25%. Early and late moderate adverse events limiting activities of daily living occurred in 28.6% of patients treated with radiotherapy. Recurrence rate after surgery was 2.5%. All meningiomas regressed or remained radiologically stable after radiotherapy. Conclusion(s): The morbidity after treatment of incidental intracranial meningioma is not negligible. Considering most operated tumors are WHO grade 1, treatment should be reserved for those manifesting symptoms or demonstrating substantial growth on radiologic surveillance. Copyright © 2020 Elsevier Inc.",http://www.elsevier.com/wps/find/journaldescription.cws_home/722082/description#description,"(Islim, Kolamunnage-Dona, Jenkinson) Institute of Translational Medicine, University of Liverpool, Liverpool, United Kingdom (Islim, Mohan, Moon) School of Medicine, University of Liverpool, Liverpool, United Kingdom (Islim, Mohan, Moon, Crofton, Brodbelt, Jenkinson) Department of Neurosurgery, The Walton Centre NHS Foundation Trust, Liverpool, United Kingdom (Rathi) Department of Neuropathology, The Walton Centre NHS Foundation Trust, Liverpool, United Kingdom (Mills) Department of Neuroradiology, The Walton Centre NHS Foundation Trust, Liverpool, United Kingdom (Haylock) Department of Clinical Oncology, The Clatterbridge Cancer Centre NHS Foundation Trust, Wirral, United KingdomA.I. Islim, Institute of Translational Medicine, University of Liverpool, Liverpool, United Kingdom. E-mail: a.islim@liv.ac.uk",2020,http://dx.doi.org/10.1016/j.wneu.2020.03.060,Journal Article,Asymptomatic;Incidental;Meningioma;Radiotherapy;Surgery;adult;aged;alopecia;article;brain abscess;brain edema;brain hematoma;brain hemorrhage;cancer grading;cancer mortality;cancer radiotherapy;cancer recurrence;cancer surgery;carcinogenesis;cerebrospinal fluid otorrhea;cohort analysis;daily life activity;drowsiness;fatigue;female;Glasgow coma scale;headache;hemiparesis;human;incidental finding;major clinical study;male;meningioma/di [Diagnosis];meningioma/et [Etiology];meningioma/rt [Radiotherapy];meningioma/su [Surgery];middle aged;migraine;morbidity;nausea;neuroimaging;nuclear magnetic resonance imaging;patient preference;patient selection;posterior fossa;postoperative complication;radiation injury;recurrence free survival;retrospective study;subdural empyema;superior sagittal sinus;treatment outcome;treatment response;vertigo;radiosurgery equipment;intracranial meningioma/di [Diagnosis];intracranial meningioma/et [Etiology];intracranial meningioma/rt [Radiotherapy];intracranial meningioma/su [Surgery];meningothelial meningioma/di [Diagnosis];meningothelial meningioma/rt [Radiotherapy];meningothelial meningioma/su [Surgery];Novalis Tx,,,2023-09-11 10:19:02,6f80e5a7-0e5d-41fa-b87d-c92751c63e4d,FN FP CNS 11092023,0a9b53c0-0532-49dd-a346-648057d10f6e,Emmy van der Ree,2023-10-18 12:52:06,Excluded,InsufficientlyScreened
bcc1dfb4-7da7-4126-a1e1-16251957c5c7,Surface-Based Falff: A Potential Novel Biomarker for Prediction of Radiation Encephalopathy in Patients With Nasopharyngeal Carcinoma,Y. M Zhang;Y. F Kang;J. J Zeng;L Li;J. M Gao;L. Z Liu;L. R Shi;W. H Liao,Frontiers in Neuroscience,Frontiers in Neuroscience,"Radiation encephalopathy (RE) is an important potential complication in patients with nasopharyngeal carcinoma (NPC) who undergo radiotherapy (RT) that can affect the quality of life. However, a functional imaging biomarker of pre-symptomatic RE has not yet been established. This study aimed to assess radiation-induced gray matter functional alterations and explore fractional amplitude of low-frequency fluctuation (fALFF) as an imaging biomarker for predicting or diagnosing RE in patients with NPC. A total of 60 patients with NPC were examined, 21 in the pre-RT cohort and 39 in the post-RT cohort. Patients in the post-RT cohort were further divided into two subgroups according to the occurrence of RE in follow-up: post-RT <inf>non-RE</inf> (n = 21) and post-RT <inf>REproved</inf><inf>infollow-up</inf> (n = 18). Surface-based and volume-based fALFF were used to detect radiation-induced functional alterations. Functional derived features were then adopted to construct a predictive model for the diagnosis of RE. We observed that surface-based fALFF could sensitively detect radiation-induced functional alterations in the intratemporal brain regions (such as the hippocampus and superior temporal gyrus), as well as the extratemporal regions (such as the insula and prefrontal lobe); however, no significant intergroup differences were observed using volume-based fALFF. No significant correlation between fALFF and radiation dose to the ipsilateral temporal lobe was observed. Support vector machine (SVM) analysis revealed that surface-based fALFF in the bilateral superior temporal gyri and left insula exhibited impressive performance (accuracy = 80.49%) in identifying patients likely to develop RE. We conclude that surface-based fALFF may serve as a sensitive imaging biomarker in the prediction of RE. © Copyright © 2021 Zhang, Kang, Zeng, Li, Gao, Liu, Shi and Liao.",https://www.frontiersin.org/journals/neuroscience#,"(Zhang, Shi, Liao) Department of Radiology, Xiangya Hospital, Central South University, Changsha, China (Kang) School of Psychology, Shaanxi Normal University, Shaanxi Provincial Key Research Center of Child Mental and Behavioral Health, Xi'an, China (Zeng) Department of Radiology, Hunan Children's Hospital, Changsha, China (Li, Liu) Sun Yat-sen University Cancer Center, State Key Laboratory of Oncology in South China, Collaborative Innovation Center for Cancer Medicine, Guangzhou, China (Gao) Department of Radiation Oncology, Collaborative Innovation Center for Cancer Medicine, State Key Laboratory of Oncology in South China, Sun Yat-sen University Cancer Center, Guangzhou, ChinaL.-R. Shi, Department of Radiology, Xiangya Hospital, Central South University, Changsha, China. E-mail: shiliangrong@csu.edu.cn W.-H. Liao, Department of Radiology, Xiangya Hospital, Central South University, Changsha, China. E-mail: owenliao@csu.edu.cn",2021,http://dx.doi.org/10.3389/fnins.2021.692575,Journal Article,imaging biomarker;machine learning;nasopharyngeal carcinoma;radiation encephalopathy;surface-based fALFF;adult;article;brain disease;brain region;cancer patient;cancer radiotherapy;cohort analysis;controlled study;diagnosis;female;follow up;fractional amplitude of low-frequency fluctuation;gray matter;hippocampus;human;insula;major clinical study;male;nasopharynx carcinoma;prediction;radiation dose;radiotherapy;superior temporal gyrus;support vector machine;biological marker,,,2023-09-11 10:19:02,6f80e5a7-0e5d-41fa-b87d-c92751c63e4d,FN FP CNS 11092023,0a9b53c0-0532-49dd-a346-648057d10f6e,Emmy van der Ree,2023-10-16 14:25:06,Included,InsufficientlyScreened
