StudyId,Title,Authors,PublicationName,AlternateName,Abstract,Url,AuthorAddress,Year,Doi,ReferenceType,Keywords,PdfRelativePath,CustomId,DateTimeStudyAdded,SystematicSearchId,SystematicSearchName,InvestigatorIds,InvestigatorNames,DateTimeOfScreenings,ScreeningDecisions,ScreeningStatus
b1eb9535-31b0-491c-b39d-8726c9c4fff9,"Melatonin secretion following brain midline irradiation is diminished, but not correlated with subjective sleep disturbances",E Rosenkranz;A Thissen;S Siegel;M Piroth;H Clusmann;J Gebauer;G Brabant;I Kreitschmann-Andermahr,Clinical Endocrinology,Clinical Endocrinology,"Objective: Cranial irradiation for brain tumours or leukaemias has been related to cognitive, endocrine and psychosocial late effects as well as sleep disturbances and increased daytime sleepiness. Studies suggest that cranial irradiation might impact on pineal melatonin secretion. Melatonin is an important regulator in human circadian rhythms and the sleep-wake cycle. The objective of this study was to investigate melatonin secretion, subjective sleep parameters and their interplay in a cohort of cranially irradiated head and brain tumour and leukaemia survivors at least 3 years after radiotherapy. Design(s): Cross-sectional study. Patient(s): Thirty-eight adults. Measurements: Melatonin secretion was evaluated by measuring its metabolite 6-sulphatoxymelatonin in collected overnight urine. Subjective sleep quality and daytime sleepiness were assessed using the Pittsburgh Sleep Quality Index and the Epworth Sleepiness Scale. The Beck Depression Inventory II was used to screen for depressive symptoms because of their impact on sleep. Result(s): Patients irradiated in the brain midline had significantly lower melatonin secretion (P = 0.008). Subjects exhibited a high prevalence of sleeping difficulties, daytime sleepiness and depression, with females and overweight subjects particularly affected. Melatonin values and subjective sleep parameters did not correlate with each other or with treatment and most patient variables. Conclusion(s): Our data suggest that radiation exposure to the pineal gland negatively affects melatonin secretion. This lack of pineal melatonin does not influence subjective sleep quality. As melatonin has important antioxidant and cancer-protective effects, further research is necessary to elucidate whether these patients have an increased risk of developing secondary neoplasms and other radiation late effects. Copyright © 2018 John Wiley & Sons Ltd",http://onlinelibrary.wiley.com/journal/10.1111/(ISSN)1365-2265,"(Rosenkranz, Thissen, Siegel, Clusmann, Kreitschmann-Andermahr) Department of Neurosurgery, University Hospital RWTH Aachen, Aachen, Germany (Piroth) Department of Radiation Oncology, University Hospital RWTH Aachen, Aachen, Germany (Gebauer, Brabant) Experimental and Clinical Endocrinology, Medical Clinic I, University of Luebeck, Luebeck, Germany (Rosenkranz) Medical Clinic II, Klinikum Augsburg, Stenglinstrasse 2, Augsburg 86156, Germany (Thissen) Department of Urology, University Hospital Cologne, Kerpener Strasse 62, Cologne 50937, Germany (Siegel, Kreitschmann-Andermahr) Department of Neurosurgery, University of Duisburg-Essen, Hufelandstrasse 55, Essen 45147, Germany (Piroth) Department of Radiation Oncology, HELIOS University Hospital Wuppertal, Witten/Herdecke University, Heusnerstrasse 40, Wuppertal 42283, GermanyI. Kreitschmann-Andermahr, Department of Neurosurgery, University of Duisburg-Essen, Hufelandstrasse 55, Essen 45147, Germany. E-mail: Ilonka.kreitschmann@uk-essen.de",2018,http://dx.doi.org/10.1111/cen.13814,Journal Article,"brain tumour;cancer survivors;cranial radiotherapy;depression;melatonin, sleep;pineal gland;acute leukemia;adult;aged;article;Beck Depression Inventory;brain tumor/rt [Radiotherapy];cancer survivor;clinical article;cohort analysis;cross-sectional study;daytime somnolence;Epworth sleepiness scale;female;human;hypopituitarism;male;nasopharynx cancer;obesity;pineal body;Pittsburgh Sleep Quality Index;prevalence;priority journal;psychometry;radiation dose;skull irradiation;sleep disorder;sleep parameters;sleep quality;stereotactic radiosurgery;melatonin/ec [Endogenous Compound];gamma knife",,,2023-09-11 10:19:02,6f80e5a7-0e5d-41fa-b87d-c92751c63e4d,FN FP CNS 11092023,0a9b53c0-0532-49dd-a346-648057d10f6e,Emmy van der Ree,2023-10-20 14:30:34,Included,InsufficientlyScreened
5e27a33f-7729-441f-af46-98512465a065,Identification of novel p53 target genes in ionizing radiation response,K. Y Jen;V. G Cheung,Cancer Research,Cancer Research,"The tumor suppressor p53 plays an essential role in cellular adaptation to stress. In response to ionizing radiation, p53 regulates the transcription of genes in a diverse set of pathways including DNA repair, cell cycle arrest, and apoptosis. Previously, we identified by microarray analysis a set of genes that are transcriptionally activated or repressed in response to radiation exposure. In this study, we use computational methods and molecular techniques, including location analysis (ChIP-on-chip assay), to identify ionizing radiation-responsive genes that are directly regulated by p53. Among the 489 ionizing radiation-responsive genes examined, 38 genes were found to be p53 targets. Some of these genes are previously known to be directly regulated by p53 whereas others are novel p53 targets. We further showed that the novel p53 target genes are transcriptionally regulated by p53. The binding of p53 to promoters of target genes correlated with increased transcript levels of these genes in cells with functional p53. However, p53 binding and subsequent transcriptional activation of these target genes were significantly diminished in cells with mutant p53 and in cells from patients with ataxia telangiectasia, which have impaired p53 activation following ionizing radiation exposure. Identification and characterization of ionizing radiation-responsive p53 target genes extend our knowledge of the diverse role that p53 plays in the DNA damage response.",https://ovidsp.ovid.com/ovidweb.cgi?T=JS&CSC=Y&NEWS=N&PAGE=fulltext&D=med6&AN=16140933,"Jen, Kuang-Yu. Department of Pediatrics, University of Pennsylvania, The Children's Hospital of Philadelphia, Philadelphia, Pennsylvania 19104, USA.",2005,,Journal Article,Ataxia Telangiectasia/ge [Genetics];Ataxia Telangiectasia/pa [Pathology];Binding Sites;Cell Line;Chromatin Immunoprecipitation;*Gene Expression Regulation/re [Radiation Effects];Humans;Lymphoid Tissue/cy [Cytology];Protein Binding/re [Radiation Effects];Response Elements/re [Radiation Effects];Transcriptional Activation/re [Radiation Effects];*Tumor Suppressor Protein p53/ge [Genetics];Tumor Suppressor Protein p53/me [Metabolism];Tumor Suppressor Protein p53/re [Radiation Effects];0 (Tumor Suppressor Protein p53),,,2023-09-11 10:19:02,6f80e5a7-0e5d-41fa-b87d-c92751c63e4d,FN FP CNS 11092023,,,,,InsufficientlyScreened
ff45adab-bdd9-4b68-b0c5-0cf81d0ebf56,[Effect of proton irradiation of the hypophysis on its gonadotropic and thyrotropic functions in patients with prolactinoma],A. V Isakov;B. A Konnov;V. V Potin;F. A Svechnikova;N. N Tkachenko,Problemy Endokrinologii,Probl Endokrinol (Mosk),"In order to study the effect of proton beam irradiation on prolactinoma cells and hypophyseal intact cells tests with i.v. administration of TRH (200 micrograms) and LH-RH (100 micrograms) were performed in 16 women with prolactin-secreting adenomas before and in 2 mos.-2 years after irradiation of the pituitary body with a high energy narrow proton beam (1000 MeV) at a dose of 40-120 Gy. A curative therapeutic effect of proton therapy which was low with respect to reproductive function recovery, was combined with lowered functional reserves of hypophyseal thyrotrophs and gonadotrophs. The informative value of the tests with the releasing hormones was shown for the determination of damage of hypophyseal intact cells. The results suggest refractivity of adenomatous lactotrophs to radiation exposure and the hypothalamic level of disorder of ovarian function regulation in this pathology.",https://ovidsp.ovid.com/ovidweb.cgi?T=JS&CSC=Y&NEWS=N&PAGE=fulltext&D=med3&AN=2848234,,1988,,Journal Article,Adult;Amenorrhea/bl [Blood];Amenorrhea/rt [Radiotherapy];Chronic Disease;Female;Gonadotropin-Releasing Hormone;Hormones/bl [Blood];Humans;Hyperprolactinemia/bl [Blood];Hyperprolactinemia/rt [Radiotherapy];Pituitary Gland/me [Metabolism];*Pituitary Gland/re [Radiation Effects];*Pituitary Irradiation;Pituitary Neoplasms/bl [Blood];*Pituitary Neoplasms/rt [Radiotherapy];Prolactinoma/bl [Blood];*Prolactinoma/rt [Radiotherapy];*Protons;Thyrotropin-Releasing Hormone;Time Factors;0 (Hormones);0 (Protons);33515-09-2 (Gonadotropin-Releasing Hormone);5Y5F15120W (Thyrotropin-Releasing Hormone),,,2023-09-11 10:19:02,6f80e5a7-0e5d-41fa-b87d-c92751c63e4d,FN FP CNS 11092023,,,,,InsufficientlyScreened
06eef2b8-a427-451c-ae35-768f4aa88538,Combination of pGL1-TNF-alpha gene and radiation (proton and gamma-ray) therapy against brain tumor,D. S Gridley;J Li;E. H Kajioka;M. L Andres;M. F Moyers;J. M Slater,Anticancer Research,Anticancer Research,"The major goal of this study was to determine if treatment with the newly constructed plasmid vector for tumor necrosis factor-alpha (pGL1-TNF-alpha) could enhance the radiation-induced growth reduction of C6 rat glioma. In addition, two different forms of ionizing radiation (gamma-rays and protons) were utilized. Body and spleen mass, leukocyte blastogenesis, and flow cytometry analysis of cell populations in blood and spleen were performed to detect toxicity, if any, and to identify mechanisms that may correlate with the anti-tumor action of combination therapy. C6 tumor cells were implanted subcutaneously into athymic mice and allowed to become established before treatment initiation. pGL1-TNF-alpha was injected into the implanted tumors, which were then irradiated 16-18 hr later; each modality was administered three times over 8-9 days. The addition of pGL1-TNF-alpha significantly enhanced the anti-tumor effect of radiation (p < 0.05). The effect was more than additive, since pGL1-TNF-alpha alone did not slow tumor progression and radiation alone had only a modest effect. Administration of pGL1-TNF-alpha together with proton radiation resulted in tumor volumes that were 23% smaller than those following pGL1-TNF-alpha + gamma-ray treatment; a similar differential in tumor size was observed in the groups receiving only radiation. Body weights and blood and spleen cell analyses did not reveal treatment-related toxicity. High basal proliferation of blood leukocytes and increased B cell levels in the spleen were associated with pGL1-TNF-alpha + 60Co (gamma-radiation) or proton treatment. Overall, the results suggest that the pGL1-TNF-alpha/radiation combination is effective and safe under the conditions employed. This is the first study to combine gene and proton radiation therapy and to show, under controlled experimental conditions, that proton radiation may have a greater effect against malignant tumors compared to the same physical dose of gamma-radiation.",https://ovidsp.ovid.com/ovidweb.cgi?T=JS&CSC=Y&NEWS=N&PAGE=fulltext&D=med4&AN=11205248,"Gridley, D S. Department of Radiation Medicine (Radiobiology Program), Loma Linda University and Medical Center, Loma Linda, CA 92354, USA. dgridley@dominion.llumc.edu",2000,,Journal Article,"Animals;Body Weight;Brain Neoplasms/im [Immunology];Brain Neoplasms/rt [Radiotherapy];*Brain Neoplasms/th [Therapy];*Cobalt Radioisotopes/tu [Therapeutic Use];Combined Modality Therapy;*Genetic Therapy/mt [Methods];*Genetic Vectors/tu [Therapeutic Use];Glioma/im [Immunology];Glioma/rt [Radiotherapy];*Glioma/th [Therapy];Killer Cells, Natural;Lymphocyte Count;Lymphocyte Subsets;Male;Mice;Mice, Nude;*Photons/tu [Therapeutic Use];*Proton Therapy;Rats;Spleen/im [Immunology];Tumor Necrosis Factor-alpha/ge [Genetics];*Tumor Necrosis Factor-alpha/tu [Therapeutic Use];0 (Cobalt Radioisotopes);0 (Tumor Necrosis Factor-alpha)",,,2023-09-11 10:19:02,6f80e5a7-0e5d-41fa-b87d-c92751c63e4d,FN FP CNS 11092023,,,,,InsufficientlyScreened
c0bc994f-0249-4a46-b666-11933cdaa6c5,Effect of alkali on the size dispersity of mammalian DNA measured by filter elution,S. C van Ankeren;K. T Wheeler,Biophysical Journal,Biophys J,"DNA from unirradiated and irradiated cultured 9L rat brain tumor cells was held for varying times in low ionic strength solutions at pH 11.0, 12.3, or 12.9. The effect of this exposure to alkali on the DNA size distribution was determined by comparing the DNA filter elution profiles obtained experimentally with those theoretically predicted for monodispersed and random distributions. At pH 12.3 or 12.9, DNA from cells irradiated with 300 rad eluted with first-order kinetics corresponding to a random DNA size distribution. The median size of the distribution decreased if the irradiated DNA was exposed to pH 12.3 for 24 h. At pH 12.3 or 12.9, DNA from unirradiated cells eluted initially with complex kinetics that later became linear (18-21 h for pH 12.3 or 13-15 h for pH 12.9), characteristic of a monodispersed DNA size distribution. Holding either unirradiated or irradiated DNA at pH 11.0, below the critical unwinding pH, produced no effect on the elution profiles. Analysis of these filter elution data indicated that after sufficient exposure to pH 12.3 or 12.9, undamaged DNA molecules from mammalian cells elute as a single-stranded monodispersed size distribution of approximately 1 X 10(10) daltons. While the possibility cannot be completely eliminated that this monodispersed size represents an upper limit determined by physical forces, these results, in conjunction with those obtained using other techniques, lend credence to the existence of a nonrandom higher-order structure in mammalian chromosomal DNA.",https://ovidsp.ovid.com/ovidweb.cgi?T=JS&CSC=Y&NEWS=N&PAGE=fulltext&D=med2&AN=6696969,,1984,,Journal Article,"Alkalies;Animals;Brain Neoplasms/an [Analysis];*DNA/ip [Isolation & Purification];DNA, Neoplasm/ip [Isolation & Purification];DNA, Neoplasm/re [Radiation Effects];DNA, Single-Stranded/ip [Isolation & Purification];Hydrogen-Ion Concentration;Hydrolysis;Molecular Weight;Rats;Ultrafiltration;0 (Alkalies);0 (DNA, Neoplasm);0 (DNA, Single-Stranded);9007-49-2 (DNA)",,,2023-09-11 10:19:02,6f80e5a7-0e5d-41fa-b87d-c92751c63e4d,FN FP CNS 11092023,0a9b53c0-0532-49dd-a346-648057d10f6e,Emmy van der Ree,2023-10-19 14:57:52,Excluded,InsufficientlyScreened
748acc2f-33bc-49c4-81ed-d65c1d27f818,Irradiation induced clonogenic cell death of human malignant glioma cells does not require CD95/CD95L interactions,J. R Streffer;M Schuster;U Pohl;C Belka;J Dichgans;M Bamberg;M Weller,Anticancer Research,Anticancer Research,"BACKGROUND: Radiotherapy is the single most effective therapy for malignant gliomas. Targeting the CD95 apoptotic pathway is a promising experimental approach to these neoplasms. Here, we asked whether irradiation modulates CD95-mediated apoptosis of human malignant glioma cells in vitro.MATERIALS AND METHODS: LN-18, LN-229 and T98G human malignant glioma cell lines were irradiated with dosages from 0-8 Gy and treated with CD95L (CD95 ligand). CD95 expression was assessed by flow cytometry. Caspase activity was determined by DEVD cleavage. Cytotoxic effects were assessed by crystal violet staining of cells in a 96-well plate assay. Clonogenic cell death was determined by a standard colony forming assay.RESULTS: We find that (i) CD95L-induced apoptosis, but not irradiation-induced clonogenic cell death, involves caspase 3 activation and is blocked by the viral caspase inhibitor, crm-A. (ii) Irradiation does not modulate CD95 expression either in p53 wild-type or in p53 mutant glioma cell lines, and does not enhance CD95L-evoked caspase 3 activity or CD95L-induced clonogenic cell death.CONCLUSIONS: We conclude that endogenous CD95/CD95L interactions are not involved in radiation-induced clonogenic cell death and that the killing cascades of CD95L and irradiation are independent in human malignant glioma cells.",https://ovidsp.ovid.com/ovidweb.cgi?T=JS&CSC=Y&NEWS=N&PAGE=fulltext&D=med4&AN=10697547,"Streffer, J R. Department of Neurology, University of Tubingen, Germany.",1999,,Journal Article,"*Apoptosis/re [Radiation Effects];Brain Neoplasms/im [Immunology];*Brain Neoplasms/pa [Pathology];Fas Ligand Protein;Glioma/im [Immunology];*Glioma/pa [Pathology];Humans;*Membrane Glycoproteins/im [Immunology];*fas Receptor/im [Immunology];0 (FASLG protein, human);0 (Fas Ligand Protein);0 (Membrane Glycoproteins);0 (fas Receptor)",,,2023-09-11 10:19:02,6f80e5a7-0e5d-41fa-b87d-c92751c63e4d,FN FP CNS 11092023,0a9b53c0-0532-49dd-a346-648057d10f6e,Emmy van der Ree,2023-10-19 14:17:37,Excluded,InsufficientlyScreened
1db0efda-dddd-446f-8fb7-163fab412a04,[Impact of neutron radiation on the viability of tumor cells cultured in the presence of boron-10 isotope],O. Y Volkova;L. V Mechetina;A. V Taranin;A. A Zaboronok;K Nakai;S. I Lezhnin;S. A Frolov;D. A Kasatov;S. I Lezhnin;S. A Frolov;D. A Kasatov;A. N Makarov;I. N Sorokin;T. V Sycheva;I. M Shchudlo;S. Y Taskaev,Vestnik Rentgenologii i Radiologii,Vestn Rentgenol Radiol,"Objective: To investigate the impact of a neutron beam formed with the accelerator-based epithermal neutron source designed at the G.I. Budker Institute of Nuclear Physics (INP) on the viability of human and animal tumor cells cultured in the presence of boron-10 isotope.Material and Methods: Human U251 and T98G glioma cells and Chinese hamster CHO-K1 and V-79 cells were incubated at various concentrations in the culture medium containing 10B-enriched L-boronophenylalanine. The cells were irradiated with a neuron beam using the accelerator-based epithermal neuron source. A clonogenic assay was used to evaluate the viability of the irradiated cells. The absorbed doses obtained from elastic scattering of fast neutrons by substance nuclei and the doses obtained from boron neutron capture were calculated using the NMS code. The absorbed doses of gamma-radiation were measured with a mixed radiation dosimeter.Results: The viability of boron-containing and intact human U251 and T98G cell lines and Chinese hamster CHO-K1 and V-79 cells was analyzed after neutron beam radiation. Irradiation of all four cell lines were cultured in the presence of 10B was shown to reduce their colony-forming capacity compared with the control. Elevated boron levels in the culture medium resulted in a significant decrease in the proportion of survived cells. Radiation had the most pronounced impact on the proliferative capacity of the human U251 glioma cell lines.Conclusion: The cultures of human tumor cells and mammalian cells demonstrated that the neutron beam formed with the accelerator-based epithermal neutron source designed at the INP, was effective in reducing the viability of tumor cells in the presence of 10B.",https://ovidsp.ovid.com/ovidweb.cgi?T=JS&CSC=Y&NEWS=N&PAGE=fulltext&D=med13&AN=30241133,,2016,,Journal Article,"Animals;*Boron/pd [Pharmacology];*Boron Neutron Capture Therapy/mt [Methods];CHO Cells/re [Radiation Effects];Cell Line, Tumor/re [Radiation Effects];Cell Survival;Cricetulus;Dose-Response Relationship, Radiation;Glioma/rt [Radiotherapy];Humans;*Isotopes/pd [Pharmacology];0 (Boron-10);0 (Isotopes);N9E3X5056Q (Boron)",,,2023-09-11 10:19:02,6f80e5a7-0e5d-41fa-b87d-c92751c63e4d,FN FP CNS 11092023,,,,,InsufficientlyScreened
5d422f99-888b-4b2e-940d-92f604c79798,Differences in the DNA supercoiling response of irradiated cell lines from ataxia-telangiectasia versus unaffected individuals,Y. C Taylor;P. G Duncan;X Zhang;W. D Wright,International Journal of Radiation Biology,International Journal of Radiation Biology,"In this study the manifestation of DNA damage at the nucleoid level was examined in several AT cell lines using an image analysis system to directly visualize and measure the changes in DNA loop size which occur when increasing concentrations of propidium iodide (PI) are used to titrate the DNA supercoiling response (the 'fluorescent halo assay'). This response consists of a relaxation (0.5-7.5 micrograms/ml PI) and rewinding phase (10-50 micrograms/ml PI), the latter of which is impaired by the presence of DNA strand breaks in irradiated cells. In addition to the inhibition of DNA rewinding seen immediately after irradiation at 0 degrees C, the supercoiling response of AT diploid fibroblasts indicated an increased amount of DNA unwinding compared to fibroblasts from unaffected individuals. This difference appeared to saturate, since the excess in DNA loop size over that seen in irradiated fibroblasts from unaffected individuals remained constant after 5 Gy. These results may reflect a greater instability of the DNA-nuclear matrix attachment points in irradiated AT fibroblasts. The DNA supercoiling response in irradiated transformed AT fibroblasts and AT lymphoblasts did not differ from that observed in unaffected cells of the same type. However, all of the immortalized cell lines (AT and unaffected) had inherently larger DNA loop sizes than diploid fibroblasts and exhibited excess unwinding after irradiation.",https://ovidsp.ovid.com/ovidweb.cgi?T=JS&CSC=Y&NEWS=N&PAGE=fulltext&D=med3&AN=1671687,"Taylor, Y C. Cancer Biology Section, Washington University School of Medicine, St. Louis, MO 63108.",1991,,Journal Article,"Ataxia Telangiectasia;Cell Line;Cell Survival/re [Radiation Effects];*DNA Damage;DNA, Superhelical/de [Drug Effects];*DNA, Superhelical/re [Radiation Effects];Dose-Response Relationship, Radiation;Fibroblasts/de [Drug Effects];Fibroblasts/re [Radiation Effects];Humans;Propidium;0 (DNA, Superhelical);36015-30-2 (Propidium)",,,2023-09-11 10:19:02,6f80e5a7-0e5d-41fa-b87d-c92751c63e4d,FN FP CNS 11092023,0a9b53c0-0532-49dd-a346-648057d10f6e,Emmy van der Ree,2023-10-05 12:09:27,Included,InsufficientlyScreened
47133024-4b7c-4ce3-8292-ff6a42425b60,Re-evaluation of prophylactic cranial irradiation in limited-stage small cell lung cancer: a propensity score matched analysis,Y Inoue;K Tsujino;N. S Sulaiman;M Marudai;A Kajihara;S Miyazaki;S Sekii;H Uezono;Y Ota;T Soejima,Journal of radiation research.,Journal of radiation research.,"We attempted to re-evaluate the efficacy of prophylactic cranial irradiation (PCI) in limited-stage small cell lung cancer (LS-SCLC) with more recent data. A total of 179 patients with LS-SCLC received radical thoracic radiotherapy and chemotherapy at our institution between 1998 and 2018. One hundred twenty-eight patients who achieved complete response (CR), good partial response (PR), and PR without progression for at least for one year after initial therapy were enrolled in this study. These patients were divided into a PCI group (group A, n=43), and a non-PCI group (group B, n=85). Survival outcomes were retrospectively evaluated. Because several background factors differed significantly between groups A and B, propensity score (PS) matching was performed as 1:1 match of the two groups. Finally, we analyzed 64 patients (group A/B=32/32). Median follow-up periods were 53 and 31 months in groups A and B, respectively. There were no significant differences between the groups' backgrounds. Two-year overall survival (OS) rates were 77% in group A and 62% in group B (p=0.224). Two-year brain metastasis free survival (BMFS) rates were 85% in group A and 57% in group B (p=0.008). The number of patients who underwent a brain imaging test for confirmation of no brain metastasis (BM) after radical thoracic radiotherapy and chemotherapy (before PCI) was 84 (group A/B=32/52). A PS matched analysis for cases of pre-PCI brain imaging group, two-year OS rates for group A/B were 73/59% (p=0.446). Two-year BMFS rates for group A/B were 91/52% (p=0.021). Retrospectively, PS matched analysis revealed that adding PCI to LS-SCLC patients who achieved good thoracic control significantly improved BMFS, but OS did not improve. Copyright © The Author(s) 2021. Published by Oxford University Press on behalf of The Japanese Radiation Research Society and Japanese Society for Radiation Oncology.",https://ovidsp.ovid.com/ovidweb.cgi?T=JS&CSC=Y&NEWS=N&PAGE=fulltext&D=emexb&AN=635554838,"(Inoue, Tsujino, Sulaiman, Marudai, Kajihara, Miyazaki, Sekii, Uezono, Ota, Soejima) Department of Radiation Oncology, Hyogo Cancer Center, Hyogo 673-8558, Japan",2021,http://dx.doi.org/10.1093/jrr/rrab053,Journal Article,brain metastasis (BM);limited stage small cell lung cancer (LS-SCLC);prophylactic cranial irradiation (PCI);small cell lung cancer (SCLC);adult;article;brain metastasis;cancer patient;cancer radiotherapy;cancer staging;cancer survival;chemotherapy;clinical assessment;controlled study;female;follow up;human;major clinical study;male;metastasis free survival;overall survival;propensity score;radiotherapy;remission;retrospective study;skull irradiation;small cell lung cancer,,,2023-09-11 10:19:02,6f80e5a7-0e5d-41fa-b87d-c92751c63e4d,FN FP CNS 11092023,,,,,InsufficientlyScreened
