StudyId,Title,Authors,PublicationName,AlternateName,Abstract,Url,AuthorAddress,Year,Doi,ReferenceType,Keywords,PdfRelativePath,CustomId,DateTimeStudyAdded,SystematicSearchId,SystematicSearchName,InvestigatorIds,InvestigatorNames,DateTimeOfScreenings,ScreeningDecisions,ScreeningStatus
ae445e8f-a3f0-43b7-ad92-fead79e6b4e1,Effect of exposure to low-dose gamma radiation during late organogenesis in the mouse fetus,P. U Devi;R Baskar;M. P Hande,Radiation Research,Radiation Research,"The abdominal region of pregnant Swiss mice was exposed to 0.05 to 0.50 Gy of gamma radiation on day 11.5 postcoitus. The animals were sacrificed on day 18 of gestation and the fetuses were examined for mortality, growth retardation, changes in head size and brain weight, and incidence of microphthalmia. No marked increase in fetal mortality or growth retardation was observed below 0.25 Gy; the increase in these parameters was significant only at 0.50 Gy. A significant reduction in head size and brain weight and a significant increase in the incidence of microphthalmia were observed at doses above 0.15 Gy. Detectable levels of microcephaly and microphthalmia were evident even at 0.10 Gy. A linear dose response was seen for these effects in the dose range of 0.05 to 0.15 Gy. It is concluded that the late period of organogenesis in the mouse, especially between days 10 and 12 postcoitus, is a particularly sensitive phase in the development of the skull, brain and eye.",https://ovidsp.ovid.com/ovidweb.cgi?T=JS&CSC=Y&NEWS=N&PAGE=fulltext&D=emed5&AN=24111196,"(Devi, Baskar, Hande) Department of Radiobiology, Kasturba Medical College, Manipal 576 119, IndiaP.U. Devi, Department of Radiobiology, Kasturba Medical College, Manipal 576 119, India",1994,http://dx.doi.org/10.2307/3578857,Journal Article,animal experiment;animal model;article;brain development;brain weight;cephalometry;dose response;fetus;fetus development;gamma radiation;intrauterine growth retardation;microcephaly;microphthalmia;mouse;nonhuman;priority journal;radiation dose;radiation exposure;radiation injury,,,2023-09-11 10:19:02,6f80e5a7-0e5d-41fa-b87d-c92751c63e4d,FN FP CNS 11092023,,,,,InsufficientlyScreened
efb9c491-cfac-4ba9-a088-626d27598721,Anti-apoptotic and antioxidant effects of low dose gamma irradiation against diabetes-induced brain injury in rats,E. R Rashed;M. A El-Daly;S. A Abd-Elhalim;M. A El-Ghazaly,Radiation & Environmental Biophysics,Radiat Environ Biophys,"The current study aimed to investigate the effect of different low doses of gamma irradiation on hyperglycemia-induced brain injury. The aim was further extended to investigate the sub-chronic effect of low dose radiation on the neuronal damage induced by diabetes. To induce diabetes, male albino rats were injected with dexamethasone (10 mg/kg/day, for 9 successive days, subcutaneously). Different diabetic groups were irradiated with 0.1, 0.25 and 0.5 Gy. The effect of low dose gamma irradiation on the hyperglycemia-induced brain damage based was analyzed at two levels: oxidative stress and apoptosis. The brain contents of glutathione, malondialdhyde and total nitrate/nitrite were measured to assess the oxidative stress. In order to evaluate the extent of the apoptotic changes in brain, tissue caspase-3 expression was detected using immunohistochemistry and the degree of DNA fragmentation was estimated. Moreover, brain tissues were examined using light microscopy to evaluate the histological changes in different groups and serum lactate dehydrogenase activity was determined as an indicator for the brain tissue damage. Results indicated that exposure to 0.5 Gy ameliorated the hyperglycemia and subsequently inhibited oxidative stress and apoptosis. Radiation exposure at this dose level also increased the survival rate of diabetic animals.",https://ovidsp.ovid.com/ovidweb.cgi?T=JS&CSC=Y&NEWS=N&PAGE=fulltext&D=med13&AN=27565141,"Rashed, Engy R. Department of Drug Radiation Research, National Center for Radiation Research and Technology, Atomic Energy Authority, PO Box 29, Nasr City, Cairo, Egypt.El-Daly, Menna A. Department of Drug Radiation Research, National Center for Radiation Research and Technology, Atomic Energy Authority, PO Box 29, Nasr City, Cairo, Egypt.Abd-Elhalim, Sawsan A. Department of Biochemistry, Faculty of Science, Helwan University, Cairo, Egypt.El-Ghazaly, Mona A. Department of Drug Radiation Research, National Center for Radiation Research and Technology, Atomic Energy Authority, PO Box 29, Nasr City, Cairo, Egypt. monaghazaly@gmail.com.",2016,,Journal Article,"Animals;*Antioxidants/me [Metabolism];*Apoptosis/re [Radiation Effects];Brain/me [Metabolism];Brain/pa [Pathology];Brain/re [Radiation Effects];*Brain Injuries/me [Metabolism];*Brain Injuries/pa [Pathology];Brain Injuries/rt [Radiotherapy];DNA Fragmentation/re [Radiation Effects];*Diabetes Complications/me [Metabolism];*Diabetes Complications/pa [Pathology];Diabetes Complications/rt [Radiotherapy];Dose-Response Relationship, Radiation;*Gamma Rays/tu [Therapeutic Use];Male;Rats;Rats, Wistar;Survival Analysis;0 (Antioxidants)",,,2023-09-11 10:19:02,6f80e5a7-0e5d-41fa-b87d-c92751c63e4d,FN FP CNS 11092023,0a9b53c0-0532-49dd-a346-648057d10f6e,Emmy van der Ree,2023-10-27 10:05:46,Excluded,InsufficientlyScreened
1f962d6e-952e-44df-b19b-81f96d74bc8a,Current status of studies on the biological effects of low-level internal irradiation,W De-Chang;Y. F Gong,International Journal of Occupational Medicine and Toxicology,International Journal of Occupational Medicine and Toxicology,"The following biological effects of relative low-level internal irradiation have been introduced. Life-Span Studies on Carcinogenesis. Pacific Northwest Laboratory observed 3,782 rats that were administered a single inhalation of <sup>239</sup>Pu0<inf>2</inf>, ranging from 0.25 to 180 nCi at initial lung burden. A significant reduction in life span was detected at doses greater than 8 Gy, and it was indicated that a 'possible' threshold of about 1 Gy for lung tumor formation was present. 2. Health Effects of Radon and Its Progeny. Both experimental and epidemiological surveys were studied. It was determined that the nominal probability coefficient (fatality) for the public and workers is 7.90 x 10<sup>5</sup> per mJm<sup>-3</sup> (2. 77 x 10<sup>-4</sup> per WLM). 3. Health Effects of <sup>3</sup>H Postnatal brain development and neurobehavior, genetic effects, carcinogenic effects, and adaptive effects of <sup>3</sup>H were investigated. 4. Study of the Effects on the Neuroendocrine System under Low-Level Irradiation by <sup>75</sup>Se (Auger Electron Emitter) and <sup>35</sup>S (beta-Particle Emitter). The results showed that the neuroendocrine system is very sensitive to small doses of internal irradiation.",https://ovidsp.ovid.com/ovidweb.cgi?T=JS&CSC=Y&NEWS=N&PAGE=fulltext&D=emed5&AN=24375003,"(De-Chang, Gong) Institute of Radiation Medicine, 27 Tai-Ping Road, Beijing, 100850, ChinaY.-F. Gong, Institute of Radiation Medicine, 27 Tai-Ping Road, Beijing, 100850, China",1994,,Journal Article,adaptation;brain development;cancer risk;carcinogenesis;conference paper;human;ionizing radiation;life expectancy;low energy radiation;neuroendocrine system;nonhuman;priority journal;radon,,,2023-09-11 10:19:02,6f80e5a7-0e5d-41fa-b87d-c92751c63e4d,FN FP CNS 11092023,,,,,InsufficientlyScreened
d6791b88-04ab-47a4-a6f6-dde734642c9c,Ionizing radiation affects epidermal growth factor receptor signalling and metalloproteinase secretion in glioma cells,M Martinou;E Giannopoulou;G Malatara;A. A Argyriou;H. P Kalofonos;D Kardamakis,Cancer Genomics & Proteomics,Cancer Genomics Proteomics,"BACKGROUND: The effect of different doses of X(-)rays on apoptosis, proliferation, epidermal growth factor receptor (EGFR) and matrix metalloproteinase (MMP-2) expression was investigated in a human glioblastoma cell line.MATERIALS AND METHODS: The cell line LN18 was irradiated at room temperature with doses ranging from 0.5 to 15 Gy using 6 MV X(-)rays. Apoptosis was assessed using the annexin V binding assay, proliferation by the methyl tetrazolium (MTT) assay and MMP-2 secretion with zymography. The levels of phosphorylated (pEGFR) were estimated using a commercially available ELISA kit.RESULTS: Cell proliferation decreased in a dose-dependent manner, while apoptosis was increased after radiation. Doses below 2 Gy did not affect proliferation or apoptosis. MMP-2 levels were increased 48 h after radiation in a dose-dependent manner. In contrast, EGFR signaling was significantly activated 15 min after radiation in a dose-dependent manner.CONCLUSION: Ionizing radiation activates EGFR signalling and enhances MMP-2 secretion, suggesting that the molecular pathways involved may contribute to the invasiveness and malignant behaviour of glioma cells and help to explain the response of gliomas to ionizing radiation.",https://ovidsp.ovid.com/ovidweb.cgi?T=JS&CSC=Y&NEWS=N&PAGE=fulltext&D=med8&AN=21289335,"Martinou, Maria. Department of Radiation Oncology, University of Patras Medical School, University Campus, 26504 Patras, Greece.",2011,,Journal Article,"*Apoptosis/re [Radiation Effects];*Brain Neoplasms/en [Enzymology];Brain Neoplasms/ge [Genetics];Cell Line, Tumor;*Cell Proliferation/re [Radiation Effects];Dose-Response Relationship, Radiation;ErbB Receptors/ge [Genetics];*ErbB Receptors/me [Metabolism];*Gene Expression Regulation, Neoplastic/re [Radiation Effects];*Glioblastoma/en [Enzymology];Glioblastoma/ge [Genetics];Humans;*Matrix Metalloproteinase 2/me [Metabolism];Phosphorylation;Receptors, Peptide/ch [Chemistry];Tetrazolium Salts/ch [Chemistry];Thiazoles/ch [Chemistry];X-Rays;0 (Receptors, Peptide);0 (Tetrazolium Salts);0 (Thiazoles);0 (annexin V receptor);EC 2-7-10-1 (ErbB Receptors);EC 3-4-24-24 (Matrix Metalloproteinase 2);EUY85H477I (thiazolyl blue)",,,2023-09-11 10:19:02,6f80e5a7-0e5d-41fa-b87d-c92751c63e4d,FN FP CNS 11092023,0a9b53c0-0532-49dd-a346-648057d10f6e,Emmy van der Ree,2023-10-23 12:42:11,Excluded,InsufficientlyScreened
54b8629a-993b-41b0-934b-5840aac00220,Radiation-induced DNA strand breaks and their repair in the developing rat brain,H Cerda;K. J Johanson;K Rosander,"International Journal of Radiation Biology & Related Studies in Physics, Chemistry & Medicine",Int J Radiat Biol Relat Stud Phys Chem Med,"Rats, 5, 10 or 25 days old, were 60 Co gamma irradiated. The induction of DNA strand breaks was studied after killing the rats within 1 min after irradiation, and the repair of the induced breaks after various intervals up to 180 min. Cell suspensions were prepared from the brain and samples were transferred into alkaline solutions. The fraction of DNA remaining double-stranded after 30 min alkali treatment was estimated after separation of single- and double-stranded DNA on hydroxylapatite. The amount of DNA strand breaks induced per Gray (1--8 Gray) was found to be in accordance with earlier in vivo studies of the mouse small intestine and mouse spleen. The DNA strand breaks in the rat brain induced by 4 Gray 60Co gamma irradiation were repaired 30 min after irradiation in all age groups studied.",https://ovidsp.ovid.com/ovidweb.cgi?T=JS&CSC=Y&NEWS=N&PAGE=fulltext&D=med1&AN=315382,,1979,,Journal Article,"Animals;Animals, Newborn;Brain/pa [Pathology];*Brain/re [Radiation Effects];Cell Survival/re [Radiation Effects];Cells, Cultured;Cobalt Radioisotopes;*DNA/re [Radiation Effects];*DNA Repair;Gamma Rays;Rats;0 (Cobalt Radioisotopes);9007-49-2 (DNA)",,,2023-09-11 10:19:02,6f80e5a7-0e5d-41fa-b87d-c92751c63e4d,FN FP CNS 11092023,0a9b53c0-0532-49dd-a346-648057d10f6e,Emmy van der Ree,2023-10-06 11:16:01,Excluded,InsufficientlyScreened
8d5eaf1b-58a1-43bb-9410-bc3adef9ac98,Use of the cytokinesis-block micronucleus assay to measure radiation-induced chromosome damage in lymphoblastoid cell lines,S Gutierrez-Enriquez;J Hall,Mutation Research,Mutation Research,"To establish the optimal experimental conditions for the use of the micronuclei (MN) test to determine the level of chromosomal damage induced by ionising radiation (IR) exposure in lymphoblastoid cell lines, a time-course study was performed comparing a normal and an ataxia telangiectasia (AT) cell line, the latter being characterised by an extreme radiation sensitivity. Several parameters were analysed: the use of cytochalasin-B (Cyt-B) to quantify MN, the optimum fixation time to measure radiation-induced MN, the most appropriate treatment dose of IR to distinguish between the normal and the radiosensitive cells and the cell-cycle distribution after irradiation. The results obtained showed that the spontaneous as well as the radiation-induced levels of MN were significantly higher in the AT cell compared to the normal cells (P < 0.001 and P = 0.005, respectively). In both cell types the number of radiation-induced MN were lower in the cultures without Cyt-B than those with Cyt-B (P < 0.001), with the AT cells being distinguished in terms of IR-induced MN from the normal cells only with the addition of Cyt-B. The level of MN formation was independent of the dose of Cyt-B used (3 or 6 microg/ml). The optimum time for radiation-induced MN measured was found to be between 48 and 72 h post-irradiation, with 2 and 4 Gy exposures inducing similar levels of MN. However, as the higher dose caused a greater delay in the cell-cycle, treatment with 2 Gy with MN measurement at 48 h in the presence of 3 microg/ml Cyt-B were chosen as the optimum experimental conditions. This choice was validated using two additional normal and AT cell lines. In conclusion, our results show that the use of Cyt-B increases the sensitivity of the MN test for comparing differences in radiosensitivity between lymphoblastoid cell lines.",https://ovidsp.ovid.com/ovidweb.cgi?T=JS&CSC=Y&NEWS=N&PAGE=fulltext&D=med5&AN=12547278,"Gutierrez-Enriquez, Sara. DNA Repair Group, International Agency for Research on Cancer, 150 cours Albert Thomas, 69372 Lyon Cedex 08, France.",2003,,Journal Article,"Ataxia Telangiectasia/ge [Genetics];Ataxia Telangiectasia Mutated Proteins;Cell Cycle;Cell Cycle Proteins;Cell Division/de [Drug Effects];Cell Line;Chromosome Aberrations;Chromosomes, Human/ge [Genetics];Chromosomes, Human/re [Radiation Effects];Cytochalasin B/pd [Pharmacology];*DNA Damage;DNA-Binding Proteins;Humans;Lymphocytes/cy [Cytology];Lymphocytes/re [Radiation Effects];*Micronucleus Tests/mt [Methods];Protein-Serine-Threonine Kinases/ge [Genetics];Radiation Tolerance/ge [Genetics];Tumor Suppressor Proteins;0 (Cell Cycle Proteins);0 (DNA-Binding Proteins);0 (Tumor Suppressor Proteins);3CHI920QS7 (Cytochalasin B);EC 2-7-11-1 (ATM protein, human);EC 2-7-11-1 (Ataxia Telangiectasia Mutated Proteins);EC 2-7-11-1 (Protein-Serine-Threonine Kinases)",,,2023-09-11 10:19:02,6f80e5a7-0e5d-41fa-b87d-c92751c63e4d,FN FP CNS 11092023,0a9b53c0-0532-49dd-a346-648057d10f6e,Emmy van der Ree,2023-09-27 14:27:47,Included,InsufficientlyScreened
4cb8fb9c-c740-492e-aa2a-a3e268a91173,Dynamics of the bioelectrical activity of the brain in patients with intrasellar pituitary adenomas irradiated with a proton beam. [Russian],I. V Dubikaitis;T. A Fedotova,Zhurnal nevropatologii i psikhiatrii imeni S.S,Zhurnal nevropatologii i psikhiatrii imeni S.S,"Sixty patients with pituitary endosellar adenomas irradiated with the proton beam were examined using EEG prior to and following irradiation in the period ranging from 14 days to 3 years. Fourteen days to three months after the proton irradiation, intensified irritation of the diencephalic structures was recorded. Later on, gradual normalization of bioelectrical activity was observed. Local changes in the temporal lobes, probably associated with the tissue response to irradiation by the proton beam were noted only in 8 out of the 60 patients.",https://ovidsp.ovid.com/ovidweb.cgi?T=JS&CSC=Y&NEWS=N&PAGE=fulltext&D=emed3&AN=15668738,I.V. Dubikaitis,1985,,Journal Article,article;brain disease/di [Diagnosis];brain disease/et [Etiology];electrodermal response;electroencephalography;human;hypophysis tumor/rt [Radiotherapy];plethysmography;radiotherapy/ae [Adverse Drug Reaction];temporal lobe;proton,,,2023-09-11 10:19:02,6f80e5a7-0e5d-41fa-b87d-c92751c63e4d,FN FP CNS 11092023,0a9b53c0-0532-49dd-a346-648057d10f6e,Emmy van der Ree,2023-10-27 10:08:29,Included,InsufficientlyScreened
3f0b2d33-b2be-4a31-8740-701bd1ce547f,Potential biological indicators of multi-organ damage: Application to radiation accident victims. [French],J. M Bertho;M Souidi;P Gourmelon,Medecine Nucleaire,Medecine Nucleaire,"Accidental irradiations induce a complex pathological situation, difficult to assess and to treat. However, recent results describing new biological indicators of radiation-induced damages such as Flt3-ligand, citrulline and oxysterol concentration in the plasma, together with results obtained in large animal models of high dose irradiation, allowed a better understanding of pathophysiological mechanisms induced by uncontrolled irradiations. This conducted to leave the classical paradigm of the acute radiation syndrome, described as the association of three individual syndromes, the hematopoietic syndrome, the gastro-intestinal syndrome and the cerebrovascular syndrome, in favour of a multiple organ dysfunction syndrome, with the implication of other organs and systems. Follow-up of victims from two recent radiation accidents brings a confirmation of the usefulness of the newly described biological indicators, and also a partial confirmation of this new concept of a multiple organ dysfunction syndrome. © 2009 Elsevier Masson SAS. All rights reserved.",https://ovidsp.ovid.com/ovidweb.cgi?T=JS&CSC=Y&NEWS=N&PAGE=fulltext&D=emed11&AN=50584026,"(Bertho, Souidi, Gourmelon) Direction de la radioprotection de l'homme, institut de radioprotection et de surete nucleaire, 92260 Fontenay-aux-Roses, FranceJ.-M. Bertho, Direction de la radioprotection de l'homme, institut de radioprotection et de surete nucleaire, 92260 Fontenay-aux-Roses, France. E-mail: jean-marc.bertho@irsn.fr",2009,http://dx.doi.org/10.1016/j.mednuc.2009.04.003,Journal Article,Accidental irradiation;Acute radiation syndrome;Biological indicators;Citrulline;Flt3-ligand;Oxysterols;acute disease/et [Etiology];cerebrovascular disease;disease model;follow up;gastrointestinal disease;hematopoietic system;human;irradiation;multiple organ failure/co [Complication];nonhuman;pathophysiology;protein blood level;radiation accident/et [Etiology];radiation dose;radiation sickness/et [Etiology];short survey;victim;citrulline/ec [Endogenous Compound];Flt3 ligand/ec [Endogenous Compound];oxysterol/ec [Endogenous Compound],,,2023-09-11 10:19:02,6f80e5a7-0e5d-41fa-b87d-c92751c63e4d,FN FP CNS 11092023,0a9b53c0-0532-49dd-a346-648057d10f6e,Emmy van der Ree,2023-10-04 15:16:24,Included,InsufficientlyScreened
6d4b01a3-c924-4b22-9e5a-ab366ba4c744,[Experimental data for administration of insulin-like growth factor 1 (IGF-1) and basic fibroblast growth factor (bFGF) for prevention of radiation myelopathy],C Nieder;R. E Price;B Rivera;N Andratschke;K. K Ang,Strahlentherapie und Onkologie,Strahlentherapie und Onkologie,"BACKGROUND: Current models of radiation myelopathy provide a rationale for growth factor-based prevention strategies. Thus, we tested whether insulin-like growth factor-1 (IGF-1) and basic fibroblast growth factor (bFGF) alone or in combination modulate radiation tolerance of the rat cervical spinal cord.MATERIALS AND METHODS: The cervical spinal cord of 68 adult Fisher F344 rats received a total dose of 30-36 Gy, given as a single fraction of 16 Gy followed by a second radiation dose of 14-20 Gy. Continuous intrathecal infusion of bFGF (44 rats) or saline (24 rats) into the cisterna magna was given concomitantly. A further experiment included 14 additional rats which were treated with subcutaneous injection of IGF-1 parallel to irradiation with a total dose of 34 Gy or 36 Gy. 20 rats received combined treatment, i.e. intrathecal infusion of bFGF plus subcutaneous injection of IGF-1, starting 24 hours before irradiation (total dose 33 Gy or 36 Gy) for a total of 4 days. Animals were followed until myelopathy developed or for a maximum of 12 months. Histopathologic examinations were performed post mortem.RESULTS: Treatment with bFGF alone or IGF-1 alone increased the median time to myelopathy significantly. In the 36-Gy group, after combination treatment a comparable prolongation of latency was seen. Moreover, rats treated with 33 Gy and combined bFGF plus IGF-1 showed a significantly reduced risk of myelopathy, too (p = 0.0015, Figures 1 and 2).CONCLUSION: Combination of IGF-1 and bFGF was more potent than single agent treatment. We observed a significantly reduced myelopathy rate at an intermediate radiation dose level and a longer time to myelopathy at a high-dose level. This finding strengthens the evidence that brief therapeutic intervention can decrease radiation-induced neurotoxicity. Further studies will be undertaken to optimize this strategy.",https://ovidsp.ovid.com/ovidweb.cgi?T=JS&CSC=Y&NEWS=N&PAGE=fulltext&D=med4&AN=11962191,"Nieder, Carsten. Klinik und Poliklinik fur Strahlentherapie und Radiologische Onkologie, Technische Universitat, Klinikum rechts der Isar, Munchen. nieder_radonc_tum@hotmail.com",2002,,Journal Article,"Animals;Dose-Response Relationship, Radiation;Drug Therapy, Combination;Female;*Fibroblast Growth Factor 2/pd [Pharmacology];*Insulin-Like Growth Factor I/pd [Pharmacology];Premedication;Radiation Injuries, Experimental/pa [Pathology];*Radiation Injuries, Experimental/pc [Prevention & Control];Radiation Tolerance/de [Drug Effects];Rats;Rats, Inbred F344;Spinal Cord/pa [Pathology];*Spinal Cord/re [Radiation Effects];103107-01-3 (Fibroblast Growth Factor 2);67763-96-6 (Insulin-Like Growth Factor I)",,,2023-09-11 10:19:02,6f80e5a7-0e5d-41fa-b87d-c92751c63e4d,FN FP CNS 11092023,,,,,InsufficientlyScreened
478c43a5-142b-437c-b8f1-de93a2a1ad77,Early neural grafts transiently reduce the behavioral effects of radiation-induced fascia dentata granule cell hypoplasia,G. A Mickley;J. L Ferguson;M. A Mulvihill;T. J Nemeth,Brain Research,Brain Research,"X-irradiation of the neonatal rat hippocampus produces a selective hypoplasia of fascia dentata granule cells, locomotor hyperactivity, perseverative movements and deficits in passive avoidance. We previously reported that transplantation of fetal hippocampal tissue into the adult (age = 182 +/- 4 days) brain produced a partial recovery of these behavioral deficits. Since graft/host interconnections are more prominent when transplants are conducted soon after radiation-induced hippocampal damage, in this study we transplanted hippocampal or cerebral cortex neurons when host rats were 33 +/- 5 days of age (i.e. only 16 days after radiogenic brain damage). Behavioral evaluations were conducted 80 and 182 days after transplantation or surgical control procedures. In the first test series only, selective components of locomotion (e.g. stereotypy and total distance traveled) and perseverative turning (e.g. mean bout length and turning speed topography) were normalized by the hippocampal grafts. Radiation-induced changes in passive avoidance were less prominent in these studies than in past experiments. Still, transplantation of hippocampal tissue improved performance on this learning task as well. Cerebral cortex grafts did not produce reliable improvements in most behavioral measures. These data suggest that hippocampal grafts placed soon after X-ray induced fascia dentata hypoplasia reduce a broad range of behavioral deficits. However, these benefits are transient and, for the most part, depend on the use of transplant tissues homologous with those damaged.",https://ovidsp.ovid.com/ovidweb.cgi?T=JS&CSC=Y&NEWS=N&PAGE=fulltext&D=med3&AN=1888998,"Mickley, G A. Behavioral Sciences Department, Armed Forces Radiobiology Research Institute, Bethesda, MD 20814-5145.",1991,,Journal Article,"Animals;*Avoidance Learning/re [Radiation Effects];Brain/ph [Physiology];*Brain/re [Radiation Effects];*Brain Tissue Transplantation/ph [Physiology];Cerebral Cortex/tr [Transplantation];Fetal Tissue Transplantation/ph [Physiology];Hippocampus/ph [Physiology];*Hippocampus/re [Radiation Effects];Hippocampus/tr [Transplantation];Male;*Motor Activity/re [Radiation Effects];Rats;Rats, Inbred Strains;*Stereotyped Behavior/re [Radiation Effects];X-Rays",,,2023-09-11 10:19:02,6f80e5a7-0e5d-41fa-b87d-c92751c63e4d,FN FP CNS 11092023,0a9b53c0-0532-49dd-a346-648057d10f6e,Emmy van der Ree,2023-10-13 13:33:18,Excluded,InsufficientlyScreened
45eb7e70-35e6-4e9c-9943-49985bf45643,Causes of death after the first sessions of irradiation of the brain in metastatic involvement. [Russian],L. I Motorina;Z. P Mikhina;L. V Shiskina,Meditsinskaia Radiologiia,Med Radiol (Mosk),Of 240 patients irradiated for metastatic brain tumors 4 died 4.5-60 h after the first session of irradiation at doses of 1.7-6 Gy. A clinicomorphological analysis showed that the main cause of death was acute microcirculatory disturbance in cerebral tissues with the formation of new hemorrhagic microfoci associated with severe disorders of cerebral tissues as a result of their involvement by far-advanced tumors.,https://ovidsp.ovid.com/ovidweb.cgi?T=JS&CSC=Y&NEWS=N&PAGE=fulltext&D=emed4&AN=18803922,L.I. Motorina,1988,,Journal Article,adult;article;brain;brain circulation;brain tumor/rt [Radiotherapy];choriocarcinoma/rt [Radiotherapy];female;human;lung tumor;male;metastasis;microcirculation;middle aged;mortality;pathology;radiation dose;small cell carcinoma/rt [Radiotherapy];time;uterus cancer,,,2023-09-11 10:19:02,6f80e5a7-0e5d-41fa-b87d-c92751c63e4d,FN FP CNS 11092023,0a9b53c0-0532-49dd-a346-648057d10f6e,Emmy van der Ree,2023-10-05 13:43:47,Included,InsufficientlyScreened
