StudyId,Title,Authors,PublicationName,AlternateName,Abstract,Url,AuthorAddress,Year,Doi,ReferenceType,Keywords,PdfRelativePath,CustomId,DateTimeStudyAdded,SystematicSearchId,SystematicSearchName,InvestigatorIds,InvestigatorNames,DateTimeOfScreenings,ScreeningDecisions,ScreeningStatus
a6a9daeb-4f41-47dd-a165-3561e5fdfc54,Ataxia-telangiectasia mutated is not required for p53 induction and apoptosis in irradiated epithelial tissues,K. E Gurley;C. J Kemp,Molecular Cancer Research: MCR,Mol Cancer Res,"The ataxia-telangiectasia mutated (Atm) protein kinase is a central regulator of the cellular response to DNA damage. Although Atm can regulate p53, it is not known if this Atm function varies between tissues. Previous studies showed that the induction of p53 and apoptosis by whole-body ionizing radiation varies greatly between tissue and tumor types, so here we asked if Atm also had a tissue-specific role in the ionizing radiation response. Irradiated Atm-null mice showed impaired p53 induction and apoptosis in thymus, spleen, and brain. In contrast, radiation-induced p53, apoptosis, phosphorylation of Chk2, and G(2)-M cell cycle arrest were slightly delayed in Atm(-/-) epithelial cells of the small intestine but reached wild-type levels by 4 h. Radiation-induced p53 and apoptosis in Atm(-/-) hair follicle epithelial cells were not impaired at any of the time points examined. Thus, Atm is essential for radiation-induced apoptosis in lymphoid tissues but is largely dispensable in epithelial cells. This indicates that marked differences in DNA damage signaling pathways exist between tissues, which could explain some of the tissue-specific phenotypes, especially tumor suppression, associated with Atm deficiency.",https://ovidsp.ovid.com/ovidweb.cgi?T=JS&CSC=Y&NEWS=N&PAGE=fulltext&D=med6&AN=18171989,"Gurley, Kay E. Fred Hutchinson Cancer Research Center, 1100 Fairview Avenue North, C1-015, Seattle, WA 90109-1024, USA.",2007,https://dx.doi.org/10.1158/1541-7786.MCR-07-0223,Journal Article,"Animals;*Apoptosis/ph [Physiology];Apoptosis/re [Radiation Effects];Ataxia Telangiectasia Mutated Proteins;Cell Cycle Proteins/ge [Genetics];*Cell Cycle Proteins/me [Metabolism];DNA Damage;DNA-Binding Proteins/ge [Genetics];*DNA-Binding Proteins/me [Metabolism];Epidermis/me [Metabolism];Epidermis/pa [Pathology];Epidermis/re [Radiation Effects];*Epithelium/me [Metabolism];Epithelium/pa [Pathology];*Epithelium/re [Radiation Effects];Female;Hair Follicle/me [Metabolism];Hair Follicle/pa [Pathology];Hair Follicle/re [Radiation Effects];Intestine, Small/me [Metabolism];Intestine, Small/pa [Pathology];Intestine, Small/re [Radiation Effects];Lymphoid Tissue/me [Metabolism];Lymphoid Tissue/pa [Pathology];Lymphoid Tissue/re [Radiation Effects];Male;Mice;Mice, Inbred Strains;Mice, Knockout;Organ Specificity;Phenotype;Protein-Serine-Threonine Kinases/ge [Genetics];*Protein-Serine-Threonine Kinases/me [Metabolism];*Tumor Suppressor Protein p53/me [Metabolism];Tumor Suppressor Proteins/ge [Genetics];*Tumor Suppressor Proteins/me [Metabolism];Whole-Body Irradiation;0 (Cell Cycle Proteins);0 (DNA-Binding Proteins);0 (Tumor Suppressor Protein p53);0 (Tumor Suppressor Proteins);EC 2-7-11-1 (Ataxia Telangiectasia Mutated Proteins);EC 2-7-11-1 (Atm protein, mouse);EC 2-7-11-1 (Protein-Serine-Threonine Kinases)",,,2023-09-11 10:19:02,6f80e5a7-0e5d-41fa-b87d-c92751c63e4d,FN FP CNS 11092023,0a9b53c0-0532-49dd-a346-648057d10f6e,Emmy van der Ree,2023-10-20 14:07:46,Excluded,InsufficientlyScreened
303c5243-fefd-46dd-b66b-ffe57e4dc760,Fail-Safe Therapy by Gamma-Ray Irradiation Against Tumor Formation by Human-Induced Pluripotent Stem Cell-Derived Neural Progenitors,M Katsukawa;Y Nakajima;A Fukumoto;D Doi;J Takahashi,Stem Cells & Development,Stem Cells Dev,"Cell replacement therapy holds great promise for Parkinson's disease (PD), but residual undifferentiated cells and immature neural progenitors in the therapy may cause tumor formation. Although cell sorting could effectively exclude these proliferative cells, from the viewpoint of clinical application, there exists no adequate coping strategy in the case of their contamination. In this study, we analyzed a component of proliferative cells in the grafts of human-induced pluripotent stem cell-derived neural progenitors and investigated the effect of radiation therapy on tumor formation. In our differentiating protocol, analyses of neural progenitors (day 19) revealed that the proliferating cells expressed early neural markers (SOX1, PAX6) or a dopaminergic neuron progenitor marker (FOXA2). When grafted into the rat striatum, these immature neurons gradually became postmitotic in the brain, and the rosette structures disappeared at 14 weeks. However, at 4-8 weeks, the SOX1(+)PAX6(+) cells formed rosette structures in the grafts, suggesting their tumorigenic potential. Therefore, to develop a fail-safe therapy against tumor formation, we investigated the effect of radiation therapy. At 4 weeks posttransplantation, when KI67(+) cells comprised the highest ratio, radiation therapy with (137)Cs Gammacell Exactor for tumor-bearing immunodeficient rats showed a significant decrease in graft volume and percentage of SOX1(+)KI67(+) cells in the graft, thus demonstrating the preventive effect of gamma-ray irradiation against tumorigenicity. These results give us critical criteria for the safety of future cell replacement therapy for PD.",https://ovidsp.ovid.com/ovidweb.cgi?T=JS&CSC=Y&NEWS=N&PAGE=fulltext&D=med13&AN=27059007,"Katsukawa, Mitsuko. 1 Department of Clinical Application, Center for iPS Cell Research and Application, Kyoto University, Kyoto, Japan .Katsukawa, Mitsuko. 2 Department of Signal Transductions, Graduate School of Biostudies, Kyoto University, Kyoto, Japan .Nakajima, Yusuke. 1 Department of Clinical Application, Center for iPS Cell Research and Application, Kyoto University, Kyoto, Japan .Fukumoto, Akiko. 1 Department of Clinical Application, Center for iPS Cell Research and Application, Kyoto University, Kyoto, Japan .Doi, Daisuke. 1 Department of Clinical Application, Center for iPS Cell Research and Application, Kyoto University, Kyoto, Japan .Takahashi, Jun. 1 Department of Clinical Application, Center for iPS Cell Research and Application, Kyoto University, Kyoto, Japan .Takahashi, Jun. 3 Department of Neurosurgery, Clinical Neuroscience, Kyoto University Graduate School of Medicine, Kyoto, Japan .",2016,https://dx.doi.org/10.1089/scd.2015.0394,Journal Article,"*Carcinogenesis/pa [Pathology];*Carcinogenesis/re [Radiation Effects];Cell Differentiation/re [Radiation Effects];Cell Line;Cell Proliferation/re [Radiation Effects];Dopaminergic Neurons/cy [Cytology];Dopaminergic Neurons/re [Radiation Effects];*Gamma Rays;Humans;Immunohistochemistry;*Induced Pluripotent Stem Cells/pa [Pathology];Induced Pluripotent Stem Cells/re [Radiation Effects];Mesencephalon/cy [Cytology];*Neural Stem Cells/pa [Pathology];Neural Stem Cells/re [Radiation Effects];Spheroids, Cellular/cy [Cytology];Spheroids, Cellular/re [Radiation Effects];Stem Cell Transplantation",,,2023-09-11 10:19:02,6f80e5a7-0e5d-41fa-b87d-c92751c63e4d,FN FP CNS 11092023,,,,,InsufficientlyScreened
cda0ab8c-79de-4040-a991-9ed5f3c4d5d5,"Linear dose response of acentric chromosome fragments down to 1 R of X rays in grasshopper neuroblasts, a potential mutagen test system",M. E Gaulden;C. B Read,Mutation Research,Mutation Research,Grasshopper-embryo neuroblasts have no spontaneous chromosome breakage; therefore they permit easy detection of agents that break chromosomes. An X-ray exposure of 1 R induces in them a detectable number of chromosome fragments. The dose-response of acentric fragment frequency fits a linear model between 0 and 128 R. Thus another cell type is added to those previously demonstrated to have no threshold dose for the induction of chromosome or gene mutations.,https://ovidsp.ovid.com/ovidweb.cgi?T=JS&CSC=Y&NEWS=N&PAGE=fulltext&D=emed2&AN=8250029,"(Gaulden, Read) Radiat. Biol. Sect., Dept. Radiol., Southwest. Med. Sch., Univ. Texas Hlth. Sci. Cent., Dallas, Tex. 75235 United StatesRadiat. Biol. Sect., Dept. Radiol., Southwest. Med. Sch., Univ. Texas Hlth. Sci. Cent., Dallas, Tex. 75235 United States",1978,,Journal Article,arthropod;histology;in vitro study;methodology;mutagen testing;mutation;neuroblast;radiation dose;theoretical study;X ray;chromosome fragment,,,2023-09-11 10:19:02,6f80e5a7-0e5d-41fa-b87d-c92751c63e4d,FN FP CNS 11092023,,,,,InsufficientlyScreened
fd7ac300-5e51-4f28-bfe9-32a415fd806c,"Combination of hypomorphic mutations of the Drosophila homologues of aryl hydrocarbon receptor and nucleosome assembly protein family genes disrupts morphogenesis, memory and detoxification",B. A Kuzin;E. A Nikitina;R. O Cherezov;J. E Vorontsova;M. S Slezinger;O. G Zatsepina;O. B Simonova;G. N Enikolopov;E. V Savvateeva-Popova,PLoS ONE [Electronic Resource],PLoS ONE,"Aryl hydrocarbon receptor is essential for biological responses to endogenous and exogenous toxins in mammals. Its Drosophila homolog spineless plays an important role in fly morphogenesis. We have previously shown that during morphogenesis spineless genetically interacts with CG5017 gene, which encodes a nucleosome assembly factor and may affect cognitive function of the fly. We now demonstrate synergistic interactions of spineless and CG5017 in pathways controlling oxidative stress response and long-term memory formation in Drosophila melanogaster. Oxidative stress was induced by low doses of X-ray irradiation of flies carrying hypomorphic mutation of spineless, mutation of CG5017, and their combination. To determine the sensitivity of these mutants to pharmacological modifiers of the irradiation effect, we irradiated flies growing on standard medium supplemented by radiosensitizer furazidin and radioprotector serotonin. The effects of irradiation were investigated by analyzing leg and antenna morphological structures and by using real-time PCR to measure mRNA expression levels for spineless, Cyp6g1 and Gst-theta genes. We also examined long-term memory in these mutants using conditioned courtship suppression paradigm. Our results show that the interaction of spineless and CG5017 is important for regulation of morphogenesis, long-term memory formation, and detoxification during oxidative stress. Since spineless and CG5017 are evolutionary conserved, these results must be considered when evaluating the risk of combining similar mutations in other organisms, including humans.",https://ovidsp.ovid.com/ovidweb.cgi?T=JS&CSC=Y&NEWS=N&PAGE=fulltext&D=med11&AN=24736732,"Kuzin, Boris A. Kol'tsov Institute of Developmental Biology, Russian Academy of Sciences, Moscow, Russia; NBIC, Moscow Institute of Physics and Technology, Moscow, Russia.Nikitina, Ekaterina A. Pavlov Institute of Physiology, Russian Academy of Sciences, St. Petersburg, Russia.Cherezov, Roman O. Kol'tsov Institute of Developmental Biology, Russian Academy of Sciences, Moscow, Russia.Vorontsova, Julia E. Kol'tsov Institute of Developmental Biology, Russian Academy of Sciences, Moscow, Russia.Slezinger, Mikhail S. Kol'tsov Institute of Developmental Biology, Russian Academy of Sciences, Moscow, Russia.Zatsepina, Olga G. Engelhardt Institute of Molecular Biology, Russian Academy of Sciences, Moscow, Russia; NBIC, Moscow Institute of Physics and Technology, Moscow, Russia.Simonova, Olga B. Kol'tsov Institute of Developmental Biology, Russian Academy of Sciences, Moscow, Russia.Enikolopov, Grigori N. NBIC, Moscow Institute of Physics and Technology, Moscow, Russia; Cold Spring Harbor Laboratory, Cold Spring Harbor, New York, United States of America.Savvateeva-Popova, Elena V. Pavlov Institute of Physiology, Russian Academy of Sciences, St. Petersburg, Russia.",2014,https://dx.doi.org/10.1371/journal.pone.0094975,Journal Article,"Animals;Drosophila/em [Embryology];*Drosophila/ge [Genetics];*Drosophila/me [Metabolism];Drosophila/re [Radiation Effects];Drosophila Proteins/ge [Genetics];Drosophila Proteins/me [Metabolism];Epistasis, Genetic;Gene Expression Regulation, Developmental/de [Drug Effects];Gene Expression Regulation, Developmental/re [Radiation Effects];Glutathione Transferase/ge [Genetics];Glutathione Transferase/me [Metabolism];Inactivation, Metabolic/ge [Genetics];Learning;Male;*Memory;*Morphogenesis/ge [Genetics];*Mutation;*Nuclear Proteins/ge [Genetics];Nucleosomes;Phenotype;*Receptors, Aryl Hydrocarbon/ge [Genetics];Receptors, Aryl Hydrocarbon/me [Metabolism];Serotonin/pd [Pharmacology];X-Rays;0 (Drosophila Proteins);0 (Nuclear Proteins);0 (Nucleosomes);0 (Receptors, Aryl Hydrocarbon);0 (mil protein, Drosophila);0 (ss protein, Drosophila);333DO1RDJY (Serotonin);EC 2-5-1-18 (Glutathione Transferase)",,,2023-09-11 10:19:02,6f80e5a7-0e5d-41fa-b87d-c92751c63e4d,FN FP CNS 11092023,0a9b53c0-0532-49dd-a346-648057d10f6e,Emmy van der Ree,2023-10-23 13:48:17,Excluded,InsufficientlyScreened
c0bdfd9d-fdb2-4acb-b5fb-8cf5de76a70a,AT cells are not radiosensitive for simple chromosomal exchanges at low dose,M Hada;J. L Huff;Z. S Patel;T Kawata;J. M Pluth;K. A George;F. A Cucinotta,Mutation Research,Mutation Research,"Cells deficient in ATM (product of the gene that is mutated in ataxia telangiectasia patients) or NBS (product of the gene mutated in the Nijmegen breakage syndrome) show increased yields of both simple and complex chromosomal aberrations after high doses (>0.5Gy) of ionizing radiation (X-rays or gamma-rays), however less is known on how these cells respond at low dose. Previously we had shown that the increased chromosome aberrations in ATM and NBS defective lines was due to a significantly larger quadratic dose-response term compared to normal fibroblasts for both simple and complex exchanges. The linear dose-response term for simple exchanges was significantly higher in NBS cells compared to wild type cells, but not for AT cells. However, AT cells have a high background level of exchanges compared to wild type or NBS cells that confounds the understanding of low dose responses. To understand the sensitivity differences for high to low doses, chromosomal aberration analysis was first performed at low dose-rates (0.5Gy/d), and results provided further evidence for the lack of sensitivity for exchanges in AT cells below doses of 1Gy. Normal lung fibroblast cells treated with KU-55933, a specific ATM kinase inhibitor, showed increased numbers of exchanges at a dose of 1Gy and higher, but were similar to wild type cells at 0.5Gy or below. These results were confirmed using siRNA knockdown of ATM. The present study provides evidence that the increased radiation sensitivity of AT cells for chromosomal exchanges found at high dose does not occur at low dose.",https://ovidsp.ovid.com/ovidweb.cgi?T=JS&CSC=Y&NEWS=N&PAGE=fulltext&D=med8&AN=21889946,"Hada, Megumi. USRA Division of Life Sciences, Houston, TX 77058, USA.",2011,https://dx.doi.org/10.1016/j.mrfmmm.2011.08.006,Journal Article,"*Ataxia Telangiectasia/ge [Genetics];Ataxia Telangiectasia Mutated Proteins;Cell Cycle Proteins/ge [Genetics];Cell Line;*Chromosome Aberrations/re [Radiation Effects];DNA Damage;DNA-Binding Proteins/ge [Genetics];Dose-Response Relationship, Radiation;Fibroblasts;Gamma Rays;Gene Knockdown Techniques;Humans;Morpholines/pd [Pharmacology];Nuclear Proteins/ge [Genetics];Protein-Serine-Threonine Kinases/ge [Genetics];Pyrones/pd [Pharmacology];*Radiation Tolerance/ge [Genetics];Tumor Suppressor Proteins/ge [Genetics];0 (2-morpholin-4-yl-6-thianthren-1-yl-pyran-4-one);0 (Cell Cycle Proteins);0 (DNA-Binding Proteins);0 (Morpholines);0 (NBN protein, human);0 (Nuclear Proteins);0 (Pyrones);0 (Tumor Suppressor Proteins);EC 2-7-11-1 (ATM protein, human);EC 2-7-11-1 (Ataxia Telangiectasia Mutated Proteins);EC 2-7-11-1 (Protein-Serine-Threonine Kinases)",,,2023-09-11 10:19:02,6f80e5a7-0e5d-41fa-b87d-c92751c63e4d,FN FP CNS 11092023,f62e24fe-d50c-48c0-89a1-13e71cb750ee,Valentina Dibenedetto,2023-10-23 08:17:37,Excluded,InsufficientlyScreened
6f9cac7d-6ac1-4d8b-96eb-f2e9f96c86a3,Redox balance- and radiation-mediated alteration in hippocampal neurogenesis,T. T Huang,Free Radical Research,Free Radic Res,"Changes in the intracellular and extracellular redox balance have been correlated with cell fate decisions in terms of proliferation versus differentiation, entering versus existing cell cycle and survival versus cell death. Adult hippocampal neurogenesis has been correlated with neuronal plasticity of learning and memory; however, the process is exquisitely sensitive to changes in redox balance. Cranial irradiation is an effective modality in treating brain tumours but often leads to deficits in hippocampus-related learning and memory, which is most likely due to sustained elevation of oxygen free radical production and suppression of hippocampal neurogenesis. The subcellular redox environment affecting hippocampal neurogenesis is largely unknown. Using mutant mice deficient in each one of the three superoxide dismutase (SOD, EC 1.15.1.1) isoforms, we have begun to determine the consequences of SOD deficiency in hippocampal neurogenesis and the related functions of learning and memory under normal condition and following cranial irradiation.",https://ovidsp.ovid.com/ovidweb.cgi?T=JS&CSC=Y&NEWS=N&PAGE=fulltext&D=med9&AN=22315982,"Huang, Ting-Ting. Geriatric Research, Education, and Care Center-GRECC, VA Palo Alto Health Care System, Palo Alto, CA 94304, USA. tthuang@stanford.edu",2012,https://dx.doi.org/10.3109/10715762.2012.664770,Journal Article,"Animals;Brain Neoplasms/en [Enzymology];Brain Neoplasms/ge [Genetics];Brain Neoplasms/pa [Pathology];*Brain Neoplasms/rt [Radiotherapy];Cell Death/re [Radiation Effects];Cell Differentiation/re [Radiation Effects];Cell Proliferation/re [Radiation Effects];Cranial Irradiation;Gamma Rays/ae [Adverse Effects];Gamma Rays/tu [Therapeutic Use];Hippocampus/en [Enzymology];Hippocampus/pa [Pathology];*Hippocampus/re [Radiation Effects];Isoenzymes/df [Deficiency];Isoenzymes/ge [Genetics];Mice;Mice, Knockout;*Neurogenesis/re [Radiation Effects];Neurons/en [Enzymology];Neurons/pa [Pathology];*Neurons/re [Radiation Effects];Oxidation-Reduction/re [Radiation Effects];*Superoxide Dismutase/df [Deficiency];Superoxide Dismutase/ge [Genetics];0 (Isoenzymes);EC 1-15-1-1 (Superoxide Dismutase)",,,2023-09-11 10:19:02,6f80e5a7-0e5d-41fa-b87d-c92751c63e4d,FN FP CNS 11092023,5b390c4f-15ed-4a90-b8e3-53794a30632d,Pasquale Castellano,2023-10-17 15:00:06,Included,InsufficientlyScreened
47863e6f-a665-4358-b9f4-90478ff79e2c,Neuronal attachment and outgrowth on a micropatterned fluorinated polyimide surface,H Kawakami;K Hiraka;S Nagaoka;Y Suzuki;M Iwaki,Journal of Artificial Organs,J Artif Organs,"In this study, we investigated the adhesion and neurite outgrowth of nerve cells on a fluorinated polyimide film micropatterned by ion irradiation. We used fluorinated polyimide because of its biocompatibility and excellent thermal and mechanical properties for ion irradiation. Rattus norvegicus chromaffin (PC12) cells were used for in vitro studies. The polyimide films were irradiated with He(+), Ne(+), or Kr(+) ions in a fluence range from 10(13) to 10(15) ions/cm(2) at 50 keV. PC12 cells selectively adhered to the polyimide film micropatterned by ion irradiation. The total neurite length for PC12 cells grown on the Kr(+)-irradiated film was the longest; the neurite length on the film irradiated by Kr(+) after 9 days was approximately five times longer than that for cells grown on the He(+)-irradiated film, i.e., 135 micro m. In addition, the PC12 differentiation rate on the ion-irradiated polyimide films also showed a similar trend to the total neurite length for PC12 cells cultured on the films: the rate decreased in the order Kr(+) > Ne(+) > He(+). This initial study indicated enhanced neurite outgrowth and differentiation of PC12 cells on fluorinated polyimide film micropatterned by ion irradiation.",https://ovidsp.ovid.com/ovidweb.cgi?T=JS&CSC=Y&NEWS=N&PAGE=fulltext&D=med5&AN=15309675,"Kawakami, Hiroyoshi. Department of Applied Chemistry, Tokyo Metropolitan University, Tokyo, Hachioji 192-0397, Japan. kawakami-hiroyoshi@c.metro-u.ac.jp",2004,,Journal Article,"Adsorption;Animals;*Biocompatible Materials;*Cell Adhesion;Cell Differentiation/ph [Physiology];*Cell Division/de [Drug Effects];Cell Division/re [Radiation Effects];Cells, Cultured;Culture Media, Conditioned;Electric Conductivity;*Materials Testing;Nerve Growth Factor/pd [Pharmacology];*Nerve Regeneration/ph [Physiology];Neurites/ph [Physiology];Neurons/ph [Physiology];Neurons/re [Radiation Effects];*PC12 Cells/cy [Cytology];PC12 Cells/ph [Physiology];Phthalic Anhydrides/re [Radiation Effects];*Phthalic Anhydrides;Polyamines/re [Radiation Effects];*Polyamines;Rats;Sensitivity and Specificity;Surface Properties;0 (Biocompatible Materials);0 (Culture Media, Conditioned);0 (Phthalic Anhydrides);0 (Polyamines);0 (poly(2,2'-bis(3,4-dicarboxyphenyl)hexafluoropropane dianhydride-co-2,2'-bis(4-aminophenyl)hexafluoropropane));9061-61-4 (Nerve Growth Factor)",,,2023-09-11 10:19:02,6f80e5a7-0e5d-41fa-b87d-c92751c63e4d,FN FP CNS 11092023,0a9b53c0-0532-49dd-a346-648057d10f6e,Emmy van der Ree,2023-09-27 14:29:08,Included,InsufficientlyScreened
eb5637f5-3b53-4339-ae3a-258981e8a6bd,"Relationship between susceptibility to protein oxidation, aging, and maximum life span potential of different species",S Agarwal;R. S Sohal,Experimental Gerontology,Experimental Gerontology,"The main objective of this study was to determine whether antioxidative potential of the tissues plays a role in the aging process. Antioxidative potential was ascertained as the susceptibility of tissues to undergo protein oxidation, manifested as protein carbonyls, in response to acute oxidative stress, induced by exposure to x-rays. Brain homogenates from 22-month-old rats were more susceptible to oxidative stress than those from three-month- old rats. Brain was more susceptible to oxidative damage than the heart. A comparison of the susceptibility of brain and heart homogenates in five different species (mouse, rat, rabbit, pig, and pigeon) indicated that maximum life span potential of the species was inversely related to their susceptibility to acute oxidative stress.",https://ovidsp.ovid.com/ovidweb.cgi?T=JS&CSC=Y&NEWS=N&PAGE=fulltext&D=emed6&AN=26170723,"(Agarwal, Sohal) Department of Biological Sciences, Southern Methodist University, Dallas, TX 75205, United StatesR.S. Sohal, Department of Biological Sciences, Southern Methodist University, Dallas, TX 75205, United States",1996,http://dx.doi.org/10.1016/0531-5565%2895%2902039-X,Journal Article,aging;antioxidants;free radicals;oxidative stress;protein oxidation;radiation;animal tissue;article;brain homogenate;drug accumulation;genetic susceptibility;lifespan;mouse;nonhuman;oxidation reduction potential;pigeon;priority journal;rabbit;rat;species differentiation;swine,,,2023-09-11 10:19:02,6f80e5a7-0e5d-41fa-b87d-c92751c63e4d,FN FP CNS 11092023,,,,,InsufficientlyScreened
